{"timestamp": "2026-06-24T12:49:35Z", "git_commit": "5913bcd", "git_dirty": true, "hypothesis_ref": "RL-2026-06-24-01", "split": "train", "config": {"lookback": 126, "mode": "gate", "backbone": "inverse_vol", "vol_target": 0.1, "vol_window": 63, "max_gross": 1.5, "rebalance": "ME"}, "objective_J": 0.5571745488683364, "metrics": {"J": 0.5571745488683364, "sharpe": 0.9630075191419128, "sortino": 1.2951114442681084, "calmar": 0.6279216296967018, "ann_return": 0.08522802086060266, "ann_vol": 0.08906704830736979, "max_drawdown": -0.13573034727561373, "turnover": 5.548405373755431, "fold_sharpes": {"2007": 0.08245147339113335, "2008": 0.6871227633443474, "2009": 0.7260500322636713, "2010": 1.0979330189557495, "2011": 0.9595207712050192, "2012": 1.3082081263291259, "2013": 1.427612039762768, "2014": 1.2249415853933454, "2015": -0.37015835000613684, "2016": 1.6478240819199401, "2017": 2.618095653437524, "2018": -0.5212787694744447, "2019": 2.7481288612322197}, "constraint_ok": true}, "status": "keep", "note": "champion baseline"}
{"timestamp": "2026-06-24T12:49:36Z", "git_commit": "5913bcd", "git_dirty": true, "hypothesis_ref": "RL-2026-06-24-01", "split": "train", "config": {"lookback": 63, "mode": "gate", "backbone": "inverse_vol", "vol_target": 0.1, "vol_window": 63, "max_gross": 1.5, "rebalance": "ME"}, "objective_J": 0.7480917261319165, "metrics": {"J": 0.7480917261319165, "sharpe": 1.065664958891229, "sortino": 1.4351471542996246, "calmar": 0.5370151608062435, "ann_return": 0.10043568423229665, "ann_vol": 0.09397386430960976, "max_drawdown": -0.18702578914440393, "turnover": 7.654031435878092, "fold_sharpes": {"2007": 1.6832204281178216, "2008": 0.8808754022077442, "2009": 1.1514768487899176, "2010": 1.9743666403497862, "2011": 1.501098253047154, "2012": 0.56664476357404, "2013": 1.120186240574169, "2014": 1.180623633009206, "2015": -0.6222973625333712, "2016": 0.7349351693712052, "2017": 2.8777166902309412, "2018": 0.2204609261401665, "2019": 2.5728322650199478}, "constraint_ok": true}, "status": "keep", "note": "lookback 63"}
{"timestamp": "2026-06-24T12:49:38Z", "git_commit": "5913bcd", "git_dirty": true, "hypothesis_ref": "RL-2026-06-24-01", "split": "train", "config": {"lookback": 189, "mode": "gate", "backbone": "inverse_vol", "vol_target": 0.1, "vol_window": 63, "max_gross": 1.5, "rebalance": "ME"}, "objective_J": 0.33205561371634307, "metrics": {"J": 0.33205561371634307, "sharpe": 0.7641859681558624, "sortino": 1.0186515214281109, "calmar": 0.42185015306800355, "ann_return": 0.06743233537074311, "ann_vol": 0.09080225651509463, "max_drawdown": -0.15984902430478154, "turnover": 5.069321132564534, "fold_sharpes": {"2007": 0.0, "2008": 0.5231980007715924, "2009": 0.43553660089602236, "2010": 1.6024616681345236, "2011": 0.5249179491820483, "2012": 1.6296059575763255, "2013": 1.0880202499480203, "2014": 0.9276172249148147, "2015": -0.47569163972457823, "2016": 0.25641770681866954, "2017": 2.400150249206659, "2018": -0.6524268131846138, "2019": 2.76330866358921}, "constraint_ok": true}, "status": "keep", "note": "lookback 189"}
{"timestamp": "2026-06-24T12:49:39Z", "git_commit": "5913bcd", "git_dirty": true, "hypothesis_ref": "RL-2026-06-24-01", "split": "train", "config": {"lookback": 252, "mode": "gate", "backbone": "inverse_vol", "vol_target": 0.1, "vol_window": 63, "max_gross": 1.5, "rebalance": "ME"}, "objective_J": 0.349449582906613, "metrics": {"J": 0.349449582906613, "sharpe": 0.831886228838263, "sortino": 1.0771942755005155, "calmar": 0.41023328731149405, "ann_return": 0.07136445391755708, "ann_vol": 0.08747811814443612, "max_drawdown": -0.17396066122583898, "turnover": 4.316098381878499, "fold_sharpes": {"2007": 0.0, "2008": -0.20320293124973882, "2009": 0.5807073614849215, "2010": 1.5394014786689572, "2011": 0.8761786212810748, "2012": 2.246251042216417, "2013": 1.2049709314599575, "2014": 0.8663365441313997, "2015": -0.0654516317428174, "2016": 0.4799237237390696, "2017": 2.8720605823195697, "2018": -1.005426572523673, "2019": 2.8838745423414753}, "constraint_ok": true}, "status": "keep", "note": "lookback 252"}
{"timestamp": "2026-06-24T12:49:41Z", "git_commit": "5913bcd", "git_dirty": true, "hypothesis_ref": "RL-2026-06-24-01", "split": "train", "config": {"lookback": 126, "mode": "gate", "backbone": "equal", "vol_target": 0.1, "vol_window": 63, "max_gross": 1.5, "rebalance": "ME"}, "objective_J": 0.32918899736894464, "metrics": {"J": 0.32918899736894464, "sharpe": 0.7453205561962938, "sortino": 0.9793321693198567, "calmar": 0.4017874123519448, "ann_return": 0.07259969175387604, "ann_vol": 0.1008853107015991, "max_drawdown": -0.1806918024855455, "turnover": 5.655011519818833, "fold_sharpes": {"2007": -0.27257693383914045, "2008": 0.37547506733238756, "2009": 0.6185810282894784, "2010": 0.7226094453530084, "2011": 0.5076771440937421, "2012": 0.9636914758698342, "2013": 1.5809631469158405, "2014": 1.0175589310573032, "2015": -0.4632561890219187, "2016": 1.508410921879246, "2017": 2.616386954605964, "2018": -0.6777495153281933, "2019": 2.1699075602718962}, "constraint_ok": true}, "status": "keep", "note": "backbone equal"}
{"timestamp": "2026-06-24T12:49:46Z", "git_commit": "5913bcd", "git_dirty": true, "hypothesis_ref": "RL-2026-06-24-01", "split": "train", "config": {"lookback": 126, "mode": "gate", "backbone": "min_variance", "vol_target": 0.1, "vol_window": 63, "max_gross": 1.5, "rebalance": "ME"}, "objective_J": 0.70980757753361, "metrics": {"J": 0.70980757753361, "sharpe": 1.0853119644855926, "sortino": 1.42978734476294, "calmar": 0.6414394603010997, "ann_return": 0.08135139442601935, "ann_vol": 0.0746423548702169, "max_drawdown": -0.12682630156216457, "turnover": 8.283206663404023, "fold_sharpes": {"2007": 0.48024407506129, "2008": 0.5994721507808489, "2009": 0.9826653261626163, "2010": 2.2468342425624384, "2011": 2.2545209980427923, "2012": 1.7373188620129776, "2013": 1.4539118830383888, "2014": 1.5988381789606823, "2015": -0.3397985217969859, "2016": 1.3845770558135138, "2017": 1.8516288985976428, "2018": -0.9495188087220372, "2019": 3.2367746684429997}, "constraint_ok": true}, "status": "keep", "note": "backbone min_variance"}
{"timestamp": "2026-06-24T12:49:47Z", "git_commit": "5913bcd", "git_dirty": true, "hypothesis_ref": "RL-2026-06-24-01", "split": "train", "config": {"lookback": 126, "mode": "tilt", "backbone": "inverse_vol", "vol_target": 0.1, "vol_window": 63, "max_gross": 1.5, "rebalance": "ME"}, "objective_J": 0.23972677342570609, "metrics": {"J": 0.23972677342570609, "sharpe": 0.6185656399853288, "sortino": 0.8192039561461658, "calmar": 0.33814505112684745, "ann_return": 0.06234156366553556, "ann_vol": 0.10705833507856007, "max_drawdown": -0.1843633773665655, "turnover": 5.895221364247097, "fold_sharpes": {"2007": -0.1820120960449281, "2008": 0.7273381300526065, "2009": 0.593717422874371, "2010": -0.10838809958409469, "2011": 0.8719095325747115, "2012": 0.3608568815103497, "2013": 1.8668389186753296, "2014": 0.9696656172981631, "2015": -0.41282850979859975, "2016": 1.2186013704759098, "2017": 2.279842139458682, "2018": -0.3554831968762827, "2019": 0.6309435024285626}, "constraint_ok": true}, "status": "keep", "note": "mode tilt"}
{"timestamp": "2026-06-24T12:49:48Z", "git_commit": "5913bcd", "git_dirty": true, "hypothesis_ref": "RL-2026-06-24-01", "split": "train", "config": {"lookback": 126, "mode": "gate", "backbone": "inverse_vol", "vol_target": 0.1, "vol_window": 63, "max_gross": 1.5, "rebalance": "2ME"}, "objective_J": 0.43378179940970335, "metrics": {"J": 0.43378179940970335, "sharpe": 0.8171548791835902, "sortino": 1.1116576544673211, "calmar": 0.3657706010227594, "ann_return": 0.07295649491435285, "ann_vol": 0.09128838341686117, "max_drawdown": -0.1994597015461428, "turnover": 3.72582529963021, "fold_sharpes": {"2007": 0.05786619399206863, "2008": -0.028561098287484647, "2009": 0.7188922931751087, "2010": 1.0189933591592033, "2011": 0.8990656377590337, "2012": 1.4042689683367462, "2013": 1.3126476469730226, "2014": 1.156913168522817, "2015": -0.6082037635734795, "2016": 1.4284346303624418, "2017": 2.4619612271151814, "2018": -0.35895286202205867, "2019": 2.2925480689029203}, "constraint_ok": true}, "status": "keep", "note": "rebalance 2ME"}
{"timestamp": "2026-06-24T12:50:26Z", "git_commit": "5913bcd", "git_dirty": true, "hypothesis_ref": "RL-2026-06-24-01", "split": "train", "config": {"lookback": 63, "mode": "gate", "backbone": "min_variance", "vol_target": 0.1, "vol_window": 63, "max_gross": 1.5, "rebalance": "ME"}, "objective_J": 0.8120407929599146, "metrics": {"J": 0.8120407929599146, "sharpe": 1.0714445969187782, "sortino": 1.4265408376611448, "calmar": 0.45617836034031223, "ann_return": 0.08417614028978582, "ann_vol": 0.07830637195540022, "max_drawdown": -0.18452462371733247, "turnover": 9.981547261859902, "fold_sharpes": {"2007": 1.9984722976592748, "2008": 0.939509536786897, "2009": 1.2660428448940024, "2010": 2.6628274673920296, "2011": 1.7405928725768427, "2012": 0.9154314727932592, "2013": 0.17952168249174863, "2014": 1.6609185793612031, "2015": -0.7037632694235678, "2016": 1.001042323303778, "2017": 2.0273595707397227, "2018": 0.49937106955966204, "2019": 2.773790667267192}, "constraint_ok": true}, "status": "keep", "note": "L63 + min_variance"}
{"timestamp": "2026-06-24T12:50:27Z", "git_commit": "5913bcd", "git_dirty": true, "hypothesis_ref": "RL-2026-06-24-01", "split": "train", "config": {"lookback": 63, "mode": "gate", "backbone": "equal", "vol_target": 0.1, "vol_window": 63, "max_gross": 1.5, "rebalance": "ME"}, "objective_J": 0.5899701971697013, "metrics": {"J": 0.5899701971697013, "sharpe": 0.9313781115397441, "sortino": 1.242750183968326, "calmar": 0.47545226037793253, "ann_return": 0.09414759715345, "ann_vol": 0.1022416106414951, "max_drawdown": -0.19801693040351298, "turnover": 7.394372295830239, "fold_sharpes": {"2007": 1.169656264541943, "2008": 0.8154427900272303, "2009": 1.3315038294043446, "2010": 1.636296236170233, "2011": 1.2710232979207179, "2012": 0.3971831328747879, "2013": 1.3604751393106502, "2014": 0.9057001364355333, "2015": -0.8046032706064548, "2016": 0.5791510931591721, "2017": 2.7645152168399263, "2018": 0.05065023722685654, "2019": 2.003928717928993}, "constraint_ok": true}, "status": "keep", "note": "L63 + equal"}
{"timestamp": "2026-06-24T12:50:29Z", "git_commit": "5913bcd", "git_dirty": true, "hypothesis_ref": "RL-2026-06-24-01", "split": "train", "config": {"lookback": 63, "mode": "gate", "backbone": "inverse_vol", "vol_target": 0.12, "vol_window": 63, "max_gross": 1.5, "rebalance": "ME"}, "objective_J": 0.7529728592054741, "metrics": {"J": 0.7529728592054741, "sharpe": 1.0438675196657619, "sortino": 1.4098536829729007, "calmar": 0.5058692235708836, "ann_return": 0.10642931867042438, "ann_vol": 0.10188372300160972, "max_drawdown": -0.21038899721779825, "turnover": 8.162492747975707, "fold_sharpes": {"2007": 1.6802891127243353, "2008": 0.8931764743421011, "2009": 1.1354309175244677, "2010": 2.012482459400882, "2011": 1.498188279068113, "2012": 0.6262925518359487, "2013": 1.1200810251242803, "2014": 1.180623633009206, "2015": -0.6466070843415789, "2016": 0.6174259924515536, "2017": 2.9189002742864703, "2018": 0.3312302549290752, "2019": 2.5728322650199478}, "constraint_ok": true}, "status": "keep", "note": "L63 + vt0.12"}
{"timestamp": "2026-06-24T12:50:30Z", "git_commit": "5913bcd", "git_dirty": true, "hypothesis_ref": "RL-2026-06-24-01", "split": "train", "config": {"lookback": 63, "mode": "gate", "backbone": "inverse_vol", "vol_target": 0.15, "vol_window": 63, "max_gross": 1.5, "rebalance": "ME"}, "objective_J": 0.7508572848158321, "metrics": {"J": 0.7508572848158321, "sharpe": 0.9978637319070229, "sortino": 1.3312510172275607, "calmar": 0.4525785823143869, "ann_return": 0.1101251387910882, "ann_vol": 0.11088373153972292, "max_drawdown": -0.24332821546245642, "turnover": 8.581373821711171, "fold_sharpes": {"2007": 1.6802891127243353, "2008": 0.8517445315259261, "2009": 1.0982346751702514, "2010": 1.9714416553460783, "2011": 1.5011029360390786, "2012": 0.6847346908277163, "2013": 1.1663249687128632, "2014": 1.180623633009206, "2015": -0.6661395600032847, "2016": 0.4997164979760303, "2017": 2.9189002742864703, "2018": 0.43901975514120406, "2019": 2.5728322650199478}, "constraint_ok": true}, "status": "keep", "note": "L63 + vt0.15"}
{"timestamp": "2026-06-24T12:50:32Z", "git_commit": "5913bcd", "git_dirty": true, "hypothesis_ref": "RL-2026-06-24-01", "split": "train", "config": {"lookback": 63, "mode": "gate", "backbone": "inverse_vol", "vol_target": 0.1, "vol_window": 42, "max_gross": 1.5, "rebalance": "ME"}, "objective_J": 0.7081861240299354, "metrics": {"J": 0.7081861240299354, "sharpe": 1.0338494728865675, "sortino": 1.3918596689964395, "calmar": 0.5289160903036209, "ann_return": 0.09801528192557685, "ann_vol": 0.09481148201200501, "max_drawdown": -0.18531348114085888, "turnover": 7.912428876782811, "fold_sharpes": {"2007": 1.4517205095747603, "2008": 0.6129258729872, "2009": 1.1161225647048065, "2010": 1.7773716098849524, "2011": 1.531362237596092, "2012": 0.6850215277267798, "2013": 1.1778608587780253, "2014": 1.1434195539479306, "2015": -0.695661986742811, "2016": 0.8059945373117522, "2017": 2.9140886265378496, "2018": 0.2421750139921993, "2019": 2.4950733019423077}, "constraint_ok": true}, "status": "keep", "note": "L63 + vw42"}
{"timestamp": "2026-06-24T12:50:33Z", "git_commit": "5913bcd", "git_dirty": true, "hypothesis_ref": "RL-2026-06-24-01", "split": "train", "config": {"lookback": 63, "mode": "gate", "backbone": "inverse_vol", "vol_target": 0.1, "vol_window": 126, "max_gross": 1.5, "rebalance": "ME"}, "objective_J": 0.5926609749660972, "metrics": {"J": 0.5926609749660972, "sharpe": 0.9962623527415887, "sortino": 1.3183090582888368, "calmar": 0.5112392989060677, "ann_return": 0.09047443322300741, "ann_vol": 0.09112478942865834, "max_drawdown": -0.17697081076631138, "turnover": 7.086480593281408, "fold_sharpes": {"2007": 0.0076277302990938834, "2008": 1.09915622054698, "2009": 0.8823386356364488, "2010": 1.9572251075266955, "2011": 1.4008868690110625, "2012": 0.7989433453316758, "2013": 1.1525392400595598, "2014": 1.0592883471176282, "2015": -0.6961594026185495, "2016": 0.903459402139908, "2017": 2.8618668597352097, "2018": 0.09525551700747865, "2019": 2.774946132733531}, "constraint_ok": true}, "status": "keep", "note": "L63 + vw126"}
{"timestamp": "2026-06-24T12:50:35Z", "git_commit": "5913bcd", "git_dirty": true, "hypothesis_ref": "RL-2026-06-24-01", "split": "train", "config": {"lookback": 63, "mode": "gate", "backbone": "inverse_vol", "vol_target": 0.1, "vol_window": 63, "max_gross": 1.0, "rebalance": "ME"}, "objective_J": 0.7465318552826095, "metrics": {"J": 0.7465318552826095, "sharpe": 0.9986431416158937, "sortino": 1.3344351784644424, "calmar": 0.4385349105129327, "ann_return": 0.07352579279931093, "ann_vol": 0.0737813729146386, "max_drawdown": -0.16766234805186075, "turnover": 5.741672302887664, "fold_sharpes": {"2007": 1.678255250230887, "2008": 0.8567067644065278, "2009": 1.0998308758468767, "2010": 1.976212460420231, "2011": 1.484515111675066, "2012": 0.6859768107860637, "2013": 1.1609162973523521, "2014": 1.188745051176429, "2015": -0.6890125798071781, "2016": 0.49515155314769355, "2017": 2.9143037660486177, "2018": 0.4379467449634268, "2019": 2.5746922951473694}, "constraint_ok": true}, "status": "keep", "note": "L63 + gross1.0"}
{"timestamp": "2026-06-24T12:50:36Z", "git_commit": "5913bcd", "git_dirty": true, "hypothesis_ref": "RL-2026-06-24-01", "split": "train", "config": {"lookback": 63, "mode": "gate", "backbone": "inverse_vol", "vol_target": 0.1, "vol_window": 63, "max_gross": 2.0, "rebalance": "ME"}, "objective_J": 0.7871281397824694, "metrics": {"J": 0.7871281397824694, "sharpe": 1.1426786865307157, "sortino": 1.5653549352889111, "calmar": 0.6086690237659277, "ann_return": 0.1199297846646683, "ann_vol": 0.10387189396241112, "max_drawdown": -0.19703612305197415, "turnover": 8.834487035146253, "fold_sharpes": {"2007": 1.7143001709520593, "2008": 0.8557428978332554, "2009": 1.1514768487899176, "2010": 2.1814864184218687, "2011": 1.5268050170672918, "2012": 0.667216775494359, "2013": 1.045972200675914, "2014": 1.2500418549558925, "2015": -0.5639402414436938, "2016": 0.8937473165550546, "2017": 2.793267626176877, "2018": 0.1952803803581887, "2019": 2.5316885181137283}, "constraint_ok": true}, "status": "keep", "note": "L63 + gross2.0"}
{"timestamp": "2026-06-24T12:51:01Z", "git_commit": "5913bcd", "git_dirty": true, "hypothesis_ref": "RL-2026-06-24-01", "split": "train", "config": {"lookback": 63, "mode": "gate", "backbone": "min_variance", "vol_target": 0.1, "vol_window": 63, "max_gross": 2.0, "rebalance": "ME"}, "objective_J": 0.804189505619158, "metrics": {"J": 0.804189505619158, "sharpe": 1.1282435085783142, "sortino": 1.516566635386622, "calmar": 0.5314623992555432, "ann_return": 0.103611806406539, "ann_vol": 0.09107928788290194, "max_drawdown": -0.19495604308352832, "turnover": 12.437332856680994, "fold_sharpes": {"2007": 2.0044777257459665, "2008": 0.8491431605283515, "2009": 1.2548814502744303, "2010": 2.569523042999972, "2011": 1.8591348436537247, "2012": 0.9193736961935539, "2013": 0.1096927750832504, "2014": 1.6531411476989872, "2015": -0.5858104792093275, "2016": 1.1287898255465962, "2017": 1.853940195840359, "2018": 0.357698869674062, "2019": 2.7975760480452903}, "constraint_ok": false}, "status": "discard", "note": "champ + gross2.0"}
{"timestamp": "2026-06-24T12:51:06Z", "git_commit": "5913bcd", "git_dirty": true, "hypothesis_ref": "RL-2026-06-24-01", "split": "train", "config": {"lookback": 63, "mode": "gate", "backbone": "min_variance", "vol_target": 0.12, "vol_window": 63, "max_gross": 1.5, "rebalance": "ME"}, "objective_J": 0.8167864648437906, "metrics": {"J": 0.8167864648437906, "sharpe": 1.035623910181859, "sortino": 1.3664665995341043, "calmar": 0.41641647992236214, "ann_return": 0.08786433368490121, "ann_vol": 0.0848066993280326, "max_drawdown": -0.21100109606921147, "turnover": 10.344577887031845, "fold_sharpes": {"2007": 1.9983014536811, "2008": 0.9333549120681408, "2009": 1.2111810194284756, "2010": 2.727813177975813, "2011": 1.7598477971116933, "2012": 0.9154314727932592, "2013": 0.25407825512545407, "2014": 1.6609185793612031, "2015": -0.7614940216295972, "2016": 0.920022859104615, "2017": 2.0297913459300734, "2018": 0.6374859992603679, "2019": 2.773790667267192}, "constraint_ok": true}, "status": "keep", "note": "champ + vt0.12"}
{"timestamp": "2026-06-24T12:51:11Z", "git_commit": "5913bcd", "git_dirty": true, "hypothesis_ref": "RL-2026-06-24-01", "split": "train", "config": {"lookback": 63, "mode": "gate", "backbone": "min_variance", "vol_target": 0.12, "vol_window": 63, "max_gross": 2.0, "rebalance": "ME"}, "objective_J": 0.8070773204410444, "metrics": {"J": 0.8070773204410444, "sharpe": 1.0872324735201677, "sortino": 1.4480786788018571, "calmar": 0.4892137074083256, "ann_return": 0.1087501483519635, "ann_vol": 0.09953071627453262, "max_drawdown": -0.22229579160420876, "turnover": 13.018963649666409, "fold_sharpes": {"2007": 2.002381374961633, "2008": 0.8912395364798021, "2009": 1.2640104027506935, "2010": 2.6282890919266895, "2011": 1.7807901295233595, "2012": 0.9178089096761692, "2013": 0.15670376029854516, "2014": 1.6531411476989872, "2015": -0.6563360661091122, "2016": 1.056679037119087, "2017": 1.9647995821983055, "2018": 0.42338911470049695, "2019": 2.7712986636589534}, "constraint_ok": false}, "status": "discard", "note": "champ + vt0.12 + gross2.0"}
{"timestamp": "2026-06-24T12:51:16Z", "git_commit": "5913bcd", "git_dirty": true, "hypothesis_ref": "RL-2026-06-24-01", "split": "train", "config": {"lookback": 63, "mode": "gate", "backbone": "min_variance", "vol_target": 0.15, "vol_window": 63, "max_gross": 2.0, "rebalance": "ME"}, "objective_J": 0.8157330713866537, "metrics": {"J": 0.8157330713866537, "sharpe": 1.043004944928063, "sortino": 1.3783712513739668, "calmar": 0.4402014860977441, "ann_return": 0.1151555142180325, "ann_vol": 0.11036587273631784, "max_drawdown": -0.2615972863673225, "turnover": 13.644006338039587, "fold_sharpes": {"2007": 2.000801860022347, "2008": 0.9359447178421474, "2009": 1.2259993575447055, "2010": 2.705618475923769, "2011": 1.7578628685763706, "2012": 0.9178089096761692, "2013": 0.2184838407703507, "2014": 1.6531411476989872, "2015": -0.7287680405086042, "2016": 0.9451501346610569, "2017": 2.027892167123026, "2018": 0.5899824465197248, "2019": 2.7712986636589534}, "constraint_ok": false}, "status": "discard", "note": "champ + vt0.15 + gross2.0"}
{"timestamp": "2026-06-24T12:51:21Z", "git_commit": "5913bcd", "git_dirty": true, "hypothesis_ref": "RL-2026-06-24-01", "split": "train", "config": {"lookback": 63, "mode": "gate", "backbone": "min_variance", "vol_target": 0.1, "vol_window": 42, "max_gross": 1.5, "rebalance": "ME"}, "objective_J": 0.8014206409804819, "metrics": {"J": 0.8014206409804819, "sharpe": 1.0708229473133337, "sortino": 1.432739550699196, "calmar": 0.46702625137803927, "ann_return": 0.08386922897895444, "ann_vol": 0.07806962787370501, "max_drawdown": -0.17958140196934158, "turnover": 10.016797154299347, "fold_sharpes": {"2007": 1.9404971823827875, "2008": 0.7563596115457153, "2009": 1.1828717279442995, "2010": 2.714141399209622, "2011": 1.8382237161329347, "2012": 0.9529297363665977, "2013": 0.12855570505496983, "2014": 1.66045989715901, "2015": -0.6384910868981608, "2016": 1.0508545038696486, "2017": 2.1042127408989515, "2018": 0.4530668021062412, "2019": 2.7621753611300464}, "constraint_ok": true}, "status": "keep", "note": "champ + vw42"}
