{"timestamp": "2026-06-24T13:13:35Z", "git_commit": "eed5a33", "git_dirty": true, "hypothesis_ref": "RL-2026-06-24-01", "split": "train", "config": {"signal": "trend", "lookback": 63, "horizon": 21, "max_depth": 3, "learning_rate": 0.05, "n_estimators": 200, "mode": "gate", "backbone": "inverse_vol", "vol_target": 0.12, "vol_window": 63, "max_gross": 2.0, "rebalance": "2ME"}, "objective_J": 0.2460928529626636, "metrics": {"J": 0.2460928529626636, "sharpe": 0.9511993246887301, "sharpe_ew": 0.6218673323055871, "sharpe_6040": 0.7614535689197587, "ir_vs_bench": 0.2460928529626636, "beats_both": true, "sortino": 1.3123406845939811, "calmar": 0.46545189523728997, "ann_return": 0.11002275735877953, "ann_vol": 0.1169544129802488, "max_drawdown": -0.23637836366030762, "turnover": 6.855767483195205, "constraint_ok": true}, "status": "keep", "note": "champ+ 2ME"}
{"timestamp": "2026-06-24T13:13:36Z", "git_commit": "eed5a33", "git_dirty": true, "hypothesis_ref": "RL-2026-06-24-01", "split": "train", "config": {"signal": "trend", "lookback": 63, "horizon": 21, "max_depth": 3, "learning_rate": 0.05, "n_estimators": 200, "mode": "tilt", "backbone": "inverse_vol", "vol_target": 0.12, "vol_window": 63, "max_gross": 2.0, "rebalance": "ME"}, "objective_J": 0.15624476335190016, "metrics": {"J": 0.15624476335190016, "sharpe": 0.7807807367202136, "sharpe_ew": 0.6218673323055871, "sharpe_6040": 0.7614535689197587, "ir_vs_bench": 0.15624476335190016, "beats_both": true, "sortino": 1.0474761686858056, "calmar": 0.30791719348696883, "ann_return": 0.09990779795915827, "ann_vol": 0.13340535266863926, "max_drawdown": -0.32446320008235074, "turnover": 10.026960928329665, "constraint_ok": false}, "status": "discard", "note": "champ+ tilt"}
{"timestamp": "2026-06-28T03:24:48Z", "git_commit": "6976b66", "git_dirty": true, "hypothesis_ref": "RL-2026-06-28-01", "universe": "fx_gold", "sample_start": "2006-05-15", "sample_end": "2026-06-25", "n_assets": 7, "cost_bps": 2.0, "strategy": "efficiency_gated_trend", "configs_tried": 360, "best_params": {"trend_lb": 126, "er_window": 42, "er_threshold": 0.3, "vol_lb": 21, "rebalance": "ME"}, "metrics": {"dev": {"sharpe": 0.897448277142157, "ann_return": 0.08324768581918773, "max_drawdown": -0.22690354335357266, "avg_turnover": 0.04075534839558483}, "test": {"sharpe": -0.206826885315684, "ann_return": -0.025267607129034197, "max_drawdown": -0.352882698814315, "avg_turnover": 0.042224459565332946}}, "status": "success"}
{"timestamp": "2026-06-28T03:54:41Z", "git_commit": "6976b66", "git_dirty": true, "hypothesis_ref": "RL-2026-06-28-02", "universe": "fx_gold", "sample_start": "2006-05-15", "sample_end": "2026-06-18", "n_assets": 7, "rebalance": "monthly", "cost_bps": 2.0, "strategy": "beta_scaled", "metrics": {"full": {"total_return": 0.5427091008721048, "annual_return": 0.021811034061102852, "sharpe": 0.3556575660789371, "max_drawdown": -0.2254575399957961, "avg_daily_turnover": 0.00917760474375038}}, "status": "success"}
{"timestamp": "2026-06-28T04:11:05Z", "git_commit": "6976b66", "git_dirty": true, "hypothesis_ref": "RL-2026-06-28-03", "universe": "us_stocks_10", "sample_start": "2012-06-01", "sample_end": "2026-06-18", "n_assets": 10, "rebalance": "daily", "cost_bps": 5.0, "strategy": "beta_long_short", "metrics": {"full": {"total_return": -0.9306406184714445, "annual_return": -0.1730332530970664, "sharpe": -0.9073193574476458, "max_drawdown": -0.9402108309944431, "avg_daily_turnover": 0.024634894297082134}}, "status": "success"}
{"timestamp": "2026-06-28T04:18:25Z", "git_commit": "6976b66", "git_dirty": true, "hypothesis_ref": "RL-2026-06-28-04", "universe": "stocks+fx_gold_individual", "n_assets": 17, "cost_bps": 5.0, "beta_lb": 252, "strategy": "beta_timing", "metrics": {"AMD": {"years": 20.5, "avg_beta": 1.71, "strat_sharpe": 0.6, "bh_sharpe": 0.52, "ann_return": 0.1176, "max_dd": -0.992, "turnover": 0.0376}, "NVDA": {"years": 20.5, "avg_beta": 1.69, "strat_sharpe": 0.76, "bh_sharpe": 0.9, "ann_return": 0.3207, "max_dd": -0.968, "turnover": 0.0337}, "TSLA": {"years": 16.0, "avg_beta": 1.57, "strat_sharpe": 0.77, "bh_sharpe": 0.89, "ann_return": 0.3352, "max_dd": -0.944, "turnover": 0.031}, "META": {"years": 14.1, "avg_beta": 1.33, "strat_sharpe": 0.68, "bh_sharpe": 0.69, "ann_return": 0.2394, "max_dd": -0.927, "turnover": 0.0127}, "AAPL": {"years": 20.5, "avg_beta": 1.1, "strat_sharpe": 0.84, "bh_sharpe": 0.92, "ann_return": 0.258, "max_dd": -0.673, "turnover": 0.007}, "WMT": {"years": 20.5, "avg_beta": 0.53, "strat_sharpe": 0.59, "bh_sharpe": 0.68, "ann_return": 0.0636, "max_dd": -0.262, "turnover": 0.005}, "KO": {"years": 20.5, "avg_beta": 0.51, "strat_sharpe": 0.52, "bh_sharpe": 0.62, "ann_return": 0.0497, "max_dd": -0.252, "turnover": 0.0042}, "JNJ": {"years": 20.5, "avg_beta": 0.51, "strat_sharpe": 0.54, "bh_sharpe": 0.62, "ann_return": 0.0485, "max_dd": -0.173, "turnover": 0.0039}, "PG": {"years": 20.5, "avg_beta": 0.49, "strat_sharpe": 0.49, "bh_sharpe": 0.5, "ann_return": 0.0442, "max_dd": -0.225, "turnover": 0.0043}, "DUK": {"years": 20.5, "avg_beta": 0.42, "strat_sharpe": 0.4, "bh_sharpe": 0.55, "ann_return": 0.0409, "max_dd": -0.258, "turnover": 0.005}, "SI=F": {"years": 20.5, "avg_beta": 0.28, "strat_sharpe": 0.48, "bh_sharpe": 0.46, "ann_return": 0.0568, "max_dd": -0.359, "turnover": 0.0087}, "AUDUSD=X": {"years": 20.1, "avg_beta": 0.21, "strat_sharpe": 0.07, "bh_sharpe": 0.03, "ann_return": 0.0016, "max_dd": -0.126, "turnover": 0.0031}, "GBPUSD=X": {"years": 20.5, "avg_beta": 0.1, "strat_sharpe": -0.08, "bh_sharpe": -0.1, "ann_return": -0.0011, "max_dd": -0.059, "turnover": 0.0025}, "JPY=X": {"years": 20.5, "avg_beta": 0.1, "strat_sharpe": 0.05, "bh_sharpe": 0.21, "ann_return": 0.0006, "max_dd": -0.043, "turnover": 0.0027}, "EURUSD=X": {"years": 20.5, "avg_beta": 0.05, "strat_sharpe": -0.05, "bh_sharpe": 0.04, "ann_return": -0.0007, "max_dd": -0.063, "turnover": 0.0025}, "GC=F": {"years": 20.5, "avg_beta": 0.02, "strat_sharpe": 0.19, "bh_sharpe": 0.64, "ann_return": 0.0055, "max_dd": -0.128, "turnover": 0.0049}, "USDCAD=X": {"years": 20.5, "avg_beta": -0.13, "strat_sharpe": -0.18, "bh_sharpe": 0.17, "ann_return": -0.0023, "max_dd": -0.068, "turnover": 0.0022}}, "status": "success"}
{"timestamp": "2026-07-07T13:07:00Z", "git_commit": "b87b200", "git_dirty": true, "hypothesis_ref": "RL-2026-06-28-05", "source": "data/raw/intraday/spy_1m.csv", "note": "PLUMBING ONLY: 1-min bars (not 1-sec), 5 days (not 36), horizon=5 bars. Not the paper's claim; pipeline end-to-end check.", "bars": 1951, "days": 5, "strategy": "order_flow_entropy", "params": {"train_days": 3, "test_days": 2, "n_folds": 1, "horizon_s": 5, "win": 30, "vol_win": 30, "low_pct": 20.0}, "metrics": {"n_folds": 1, "oos": {"n": 776, "n_low": 201, "uncond_abs_bps": 5.227, "low_abs_bps": 5.067, "ratio": 0.97, "t_stat": -0.48, "dir_acc": 0.458}, "folds": [{"fold": 0, "h_thr": 0.3576, "n_test": 776, "n_low": 201, "ratio": 0.97, "dir_acc": 0.458}]}, "status": "success"}
{"timestamp": "2026-07-07T13:48:43Z", "git_commit": "4e56274", "git_dirty": true, "hypothesis_ref": "RL-2026-07-07", "universe": "ETF24", "sample_start": "2007-06-01", "sample_end": "2026-07-07", "n_assets": 22, "split": "2016-01-01", "cost_bps": 5.0, "strategy": "anomaly_replication_24", "n_trials": 24, "metrics": [{"code": "20", "name": "risk_parity_erc", "full_sharpe": 0.685, "test_sharpe": 0.965, "test_tstat": 3.124, "test_p": 0.0009, "turnover": 0.0052, "bh_pass": true, "dsr": 0.422}, {"code": "23", "name": "min_correlation", "full_sharpe": 0.678, "test_sharpe": 0.913, "test_tstat": 2.956, "test_p": 0.0016, "turnover": 0.0017, "bh_pass": true, "dsr": 0.359}, {"code": "15", "name": "vol_managed", "full_sharpe": 0.732, "test_sharpe": 0.906, "test_tstat": 2.934, "test_p": 0.0017, "turnover": 0.0091, "bh_pass": true, "dsr": 0.351}, {"code": "14", "name": "dual_momentum", "full_sharpe": 0.734, "test_sharpe": 0.774, "test_tstat": 2.505, "test_p": 0.0061, "turnover": 0.019, "bh_pass": true, "dsr": 0.209}, {"code": "24", "name": "dual_mom_erc", "full_sharpe": 0.713, "test_sharpe": 0.758, "test_tstat": 2.453, "test_p": 0.0071, "turnover": 0.0205, "bh_pass": true, "dsr": 0.195}, {"code": "21", "name": "max_diversification", "full_sharpe": 0.759, "test_sharpe": 0.754, "test_tstat": 2.442, "test_p": 0.0073, "turnover": 0.009, "bh_pass": true, "dsr": 0.19}, {"code": "22", "name": "hrp", "full_sharpe": 0.723, "test_sharpe": 0.726, "test_tstat": 2.35, "test_p": 0.0094, "turnover": 0.0081, "bh_pass": true, "dsr": 0.169}, {"code": "16", "name": "crash_scaled_tsmom", "full_sharpe": 0.643, "test_sharpe": 0.428, "test_tstat": 1.386, "test_p": 0.083, "turnover": 0.0281, "bh_pass": false, "dsr": 0.028}, {"code": "12", "name": "tsmom", "full_sharpe": 0.46, "test_sharpe": 0.331, "test_tstat": 1.072, "test_p": 0.1419, "turnover": 0.0122, "bh_pass": false, "dsr": 0.013}, {"code": "08", "name": "skewness", "full_sharpe": 0.16, "test_sharpe": 0.203, "test_tstat": 0.658, "test_p": 0.2552, "turnover": 0.0166, "bh_pass": false, "dsr": 0.004}, {"code": "18", "name": "bollinger", "full_sharpe": -0.055, "test_sharpe": 0.163, "test_tstat": 0.529, "test_p": 0.2985, "turnover": 0.2679, "bh_pass": false, "dsr": 0.002}, {"code": "13", "name": "donchian", "full_sharpe": 0.368, "test_sharpe": 0.155, "test_tstat": 0.5, "test_p": 0.3085, "turnover": 0.0083, "bh_pass": false, "dsr": 0.002}, {"code": "02", "name": "momentum_12_1", "full_sharpe": 0.209, "test_sharpe": 0.076, "test_tstat": 0.247, "test_p": 0.4023, "turnover": 0.0181, "bh_pass": false, "dsr": 0.001}, {"code": "05", "name": "idio_vol", "full_sharpe": 0.169, "test_sharpe": -0.006, "test_tstat": -0.018, "test_p": 0.5072, "turnover": 0.0049, "bh_pass": false, "dsr": 0.0}, {"code": "19", "name": "pairs", "full_sharpe": -0.09, "test_sharpe": -0.095, "test_tstat": -0.308, "test_p": 0.621, "turnover": 0.0487, "bh_pass": false, "dsr": 0.0}, {"code": "10", "name": "seasonality", "full_sharpe": -0.334, "test_sharpe": -0.227, "test_tstat": -0.736, "test_p": 0.769, "turnover": 0.0608, "bh_pass": false, "dsr": 0.0}, {"code": "07", "name": "high_52w", "full_sharpe": 0.058, "test_sharpe": -0.23, "test_tstat": -0.743, "test_p": 0.7713, "turnover": 0.0285, "bh_pass": false, "dsr": 0.0}, {"code": "09", "name": "residual_momentum", "full_sharpe": 0.103, "test_sharpe": -0.233, "test_tstat": -0.754, "test_p": 0.7746, "turnover": 0.0169, "bh_pass": false, "dsr": 0.0}, {"code": "01", "name": "short_term_reversal", "full_sharpe": 0.009, "test_sharpe": -0.279, "test_tstat": -0.903, "test_p": 0.8166, "turnover": 0.2698, "bh_pass": false, "dsr": 0.0}, {"code": "17", "name": "overnight_intraday", "full_sharpe": -0.166, "test_sharpe": -0.29, "test_tstat": -0.938, "test_p": 0.8259, "turnover": 0.3064, "bh_pass": false, "dsr": 0.0}, {"code": "03", "name": "long_term_reversal", "full_sharpe": -0.26, "test_sharpe": -0.372, "test_tstat": -1.206, "test_p": 0.886, "turnover": 0.0075, "bh_pass": false, "dsr": 0.0}, {"code": "11", "name": "downside_beta", "full_sharpe": -0.269, "test_sharpe": -0.486, "test_tstat": -1.574, "test_p": 0.9422, "turnover": 0.0066, "bh_pass": false, "dsr": 0.0}, {"code": "04", "name": "low_volatility", "full_sharpe": -0.196, "test_sharpe": -0.541, "test_tstat": -1.75, "test_p": 0.9599, "turnover": 0.0061, "bh_pass": false, "dsr": 0.0}, {"code": "06", "name": "max_lottery", "full_sharpe": -0.334, "test_sharpe": -0.722, "test_tstat": -2.337, "test_p": 0.9902, "turnover": 0.0356, "bh_pass": false, "dsr": 0.0}], "survivors": [], "status": "success"}
{"timestamp": "2026-07-07T14:17:48Z", "git_commit": "e5916a6", "git_dirty": true, "hypothesis_ref": "RL-2026-07-07", "universe": "ETF24", "sample_start": "2007-06-01", "sample_end": "2026-07-07", "n_assets": 22, "split": "2016-01-01", "cost_bps": 5.0, "strategy": "anomaly_replication_32", "n_trials": 32, "metrics": [{"code": "20", "name": "risk_parity_erc", "full_sharpe": 0.685, "test_sharpe": 0.965, "test_tstat": 3.124, "test_p": 0.0009, "turnover": 0.0052, "bh_pass": true, "dsr": 0.43}, {"code": "23", "name": "min_correlation", "full_sharpe": 0.678, "test_sharpe": 0.913, "test_tstat": 2.956, "test_p": 0.0016, "turnover": 0.0017, "bh_pass": true, "dsr": 0.367}, {"code": "15", "name": "vol_managed", "full_sharpe": 0.732, "test_sharpe": 0.906, "test_tstat": 2.934, "test_p": 0.0017, "turnover": 0.0091, "bh_pass": true, "dsr": 0.358}, {"code": "14", "name": "dual_momentum", "full_sharpe": 0.734, "test_sharpe": 0.774, "test_tstat": 2.505, "test_p": 0.0061, "turnover": 0.019, "bh_pass": true, "dsr": 0.215}, {"code": "24", "name": "dual_mom_erc", "full_sharpe": 0.713, "test_sharpe": 0.758, "test_tstat": 2.453, "test_p": 0.0071, "turnover": 0.0205, "bh_pass": true, "dsr": 0.2}, {"code": "21", "name": "max_diversification", "full_sharpe": 0.759, "test_sharpe": 0.754, "test_tstat": 2.442, "test_p": 0.0073, "turnover": 0.009, "bh_pass": true, "dsr": 0.196}, {"code": "22", "name": "hrp", "full_sharpe": 0.723, "test_sharpe": 0.726, "test_tstat": 2.35, "test_p": 0.0094, "turnover": 0.0081, "bh_pass": true, "dsr": 0.174}, {"code": "32", "name": "volume_momentum", "full_sharpe": 0.27, "test_sharpe": 0.455, "test_tstat": 1.472, "test_p": 0.0705, "turnover": 0.0594, "bh_pass": false, "dsr": 0.035}, {"code": "16", "name": "crash_scaled_tsmom", "full_sharpe": 0.643, "test_sharpe": 0.428, "test_tstat": 1.386, "test_p": 0.083, "turnover": 0.0281, "bh_pass": false, "dsr": 0.029}, {"code": "28", "name": "low_52w", "full_sharpe": 0.242, "test_sharpe": 0.404, "test_tstat": 1.309, "test_p": 0.0954, "turnover": 0.0192, "bh_pass": false, "dsr": 0.024}, {"code": "31", "name": "ma_trend", "full_sharpe": 0.473, "test_sharpe": 0.364, "test_tstat": 1.18, "test_p": 0.1191, "turnover": 0.0167, "bh_pass": false, "dsr": 0.017}, {"code": "12", "name": "tsmom", "full_sharpe": 0.46, "test_sharpe": 0.331, "test_tstat": 1.072, "test_p": 0.1419, "turnover": 0.0122, "bh_pass": false, "dsr": 0.013}, {"code": "30", "name": "turn_of_month", "full_sharpe": 0.097, "test_sharpe": 0.297, "test_tstat": 0.96, "test_p": 0.1685, "turnover": 0.0962, "bh_pass": false, "dsr": 0.009}, {"code": "08", "name": "skewness", "full_sharpe": 0.16, "test_sharpe": 0.203, "test_tstat": 0.658, "test_p": 0.2552, "turnover": 0.0166, "bh_pass": false, "dsr": 0.004}, {"code": "18", "name": "bollinger", "full_sharpe": -0.055, "test_sharpe": 0.163, "test_tstat": 0.529, "test_p": 0.2985, "turnover": 0.2679, "bh_pass": false, "dsr": 0.003}, {"code": "13", "name": "donchian", "full_sharpe": 0.368, "test_sharpe": 0.155, "test_tstat": 0.5, "test_p": 0.3085, "turnover": 0.0083, "bh_pass": false, "dsr": 0.003}, {"code": "02", "name": "momentum_12_1", "full_sharpe": 0.209, "test_sharpe": 0.076, "test_tstat": 0.247, "test_p": 0.4023, "turnover": 0.0181, "bh_pass": false, "dsr": 0.001}, {"code": "27", "name": "kurtosis", "full_sharpe": 0.09, "test_sharpe": 0.032, "test_tstat": 0.104, "test_p": 0.4585, "turnover": 0.0155, "bh_pass": false, "dsr": 0.001}, {"code": "05", "name": "idio_vol", "full_sharpe": 0.169, "test_sharpe": -0.006, "test_tstat": -0.018, "test_p": 0.5072, "turnover": 0.0049, "bh_pass": false, "dsr": 0.0}, {"code": "19", "name": "pairs", "full_sharpe": -0.09, "test_sharpe": -0.095, "test_tstat": -0.308, "test_p": 0.621, "turnover": 0.0487, "bh_pass": false, "dsr": 0.0}, {"code": "26", "name": "sharpe_momentum", "full_sharpe": 0.111, "test_sharpe": -0.095, "test_tstat": -0.308, "test_p": 0.6209, "turnover": 0.0186, "bh_pass": false, "dsr": 0.0}, {"code": "10", "name": "seasonality", "full_sharpe": -0.334, "test_sharpe": -0.227, "test_tstat": -0.736, "test_p": 0.769, "turnover": 0.0608, "bh_pass": false, "dsr": 0.0}, {"code": "07", "name": "high_52w", "full_sharpe": 0.058, "test_sharpe": -0.23, "test_tstat": -0.743, "test_p": 0.7713, "turnover": 0.0285, "bh_pass": false, "dsr": 0.0}, {"code": "09", "name": "residual_momentum", "full_sharpe": 0.103, "test_sharpe": -0.233, "test_tstat": -0.754, "test_p": 0.7746, "turnover": 0.0169, "bh_pass": false, "dsr": 0.0}, {"code": "01", "name": "short_term_reversal", "full_sharpe": 0.009, "test_sharpe": -0.279, "test_tstat": -0.903, "test_p": 0.8166, "turnover": 0.2698, "bh_pass": false, "dsr": 0.0}, {"code": "17", "name": "overnight_intraday", "full_sharpe": -0.166, "test_sharpe": -0.29, "test_tstat": -0.938, "test_p": 0.8259, "turnover": 0.3064, "bh_pass": false, "dsr": 0.0}, {"code": "03", "name": "long_term_reversal", "full_sharpe": -0.26, "test_sharpe": -0.372, "test_tstat": -1.206, "test_p": 0.886, "turnover": 0.0075, "bh_pass": false, "dsr": 0.0}, {"code": "25", "name": "bab_beta", "full_sharpe": -0.303, "test_sharpe": -0.468, "test_tstat": -1.516, "test_p": 0.9352, "turnover": 0.0049, "bh_pass": false, "dsr": 0.0}, {"code": "11", "name": "downside_beta", "full_sharpe": -0.269, "test_sharpe": -0.486, "test_tstat": -1.574, "test_p": 0.9422, "turnover": 0.0066, "bh_pass": false, "dsr": 0.0}, {"code": "29", "name": "parkinson_lowrange", "full_sharpe": -0.263, "test_sharpe": -0.535, "test_tstat": -1.732, "test_p": 0.9583, "turnover": 0.0199, "bh_pass": false, "dsr": 0.0}, {"code": "04", "name": "low_volatility", "full_sharpe": -0.196, "test_sharpe": -0.541, "test_tstat": -1.75, "test_p": 0.9599, "turnover": 0.0061, "bh_pass": false, "dsr": 0.0}, {"code": "06", "name": "max_lottery", "full_sharpe": -0.334, "test_sharpe": -0.722, "test_tstat": -2.337, "test_p": 0.9902, "turnover": 0.0356, "bh_pass": false, "dsr": 0.0}], "survivors": [], "status": "success"}
