{"timestamp": "2026-07-07T14:18:50Z", "git_commit": "e5916a6", "git_dirty": true, "hypothesis_ref": "RL-2026-07-09", "universe": "NSE12", "sample_start": "2011-08-04", "sample_end": "2026-07-07", "n_assets": 12, "split": "2018-01-01", "cost_bps": 20.0, "strategy": "anomaly_replication_32", "n_trials": 32, "metrics": [{"code": "22", "name": "hrp", "full_sharpe": 0.881, "test_sharpe": 0.787, "test_tstat": 2.26, "test_p": 0.012, "turnover": 0.0058, "bh_pass": false, "dsr": NaN}, {"code": "20", "name": "risk_parity_erc", "full_sharpe": 0.842, "test_sharpe": 0.754, "test_tstat": 2.164, "test_p": 0.0153, "turnover": 0.0024, "bh_pass": false, "dsr": NaN}, {"code": "21", "name": "max_diversification", "full_sharpe": 0.823, "test_sharpe": 0.741, "test_tstat": 2.127, "test_p": 0.0168, "turnover": 0.0059, "bh_pass": false, "dsr": NaN}, {"code": "15", "name": "vol_managed", "full_sharpe": 0.749, "test_sharpe": 0.69, "test_tstat": 1.982, "test_p": 0.0238, "turnover": 0.0095, "bh_pass": false, "dsr": NaN}, {"code": "23", "name": "min_correlation", "full_sharpe": 0.761, "test_sharpe": 0.668, "test_tstat": 1.919, "test_p": 0.0276, "turnover": 0.0021, "bh_pass": false, "dsr": NaN}, {"code": "24", "name": "dual_mom_erc", "full_sharpe": 0.653, "test_sharpe": 0.514, "test_tstat": 1.476, "test_p": 0.07, "turnover": 0.0186, "bh_pass": false, "dsr": NaN}, {"code": "14", "name": "dual_momentum", "full_sharpe": 0.641, "test_sharpe": 0.486, "test_tstat": 1.394, "test_p": 0.0817, "turnover": 0.0194, "bh_pass": false, "dsr": NaN}, {"code": "16", "name": "crash_scaled_tsmom", "full_sharpe": 0.433, "test_sharpe": 0.309, "test_tstat": 0.888, "test_p": 0.1874, "turnover": 0.0273, "bh_pass": false, "dsr": NaN}, {"code": "26", "name": "sharpe_momentum", "full_sharpe": 0.167, "test_sharpe": 0.29, "test_tstat": 0.833, "test_p": 0.2026, "turnover": 0.0184, "bh_pass": false, "dsr": NaN}, {"code": "09", "name": "residual_momentum", "full_sharpe": 0.046, "test_sharpe": 0.284, "test_tstat": 0.815, "test_p": 0.2075, "turnover": 0.0165, "bh_pass": false, "dsr": NaN}, {"code": "05", "name": "idio_vol", "full_sharpe": 0.184, "test_sharpe": 0.277, "test_tstat": 0.797, "test_p": 0.2129, "turnover": 0.0058, "bh_pass": false, "dsr": NaN}, {"code": "30", "name": "turn_of_month", "full_sharpe": 0.117, "test_sharpe": 0.243, "test_tstat": 0.696, "test_p": 0.2431, "turnover": 0.0985, "bh_pass": false, "dsr": NaN}, {"code": "31", "name": "ma_trend", "full_sharpe": 0.283, "test_sharpe": 0.195, "test_tstat": 0.559, "test_p": 0.288, "turnover": 0.0202, "bh_pass": false, "dsr": NaN}, {"code": "02", "name": "momentum_12_1", "full_sharpe": 0.019, "test_sharpe": 0.191, "test_tstat": 0.547, "test_p": 0.2921, "turnover": 0.0182, "bh_pass": false, "dsr": NaN}, {"code": "27", "name": "kurtosis", "full_sharpe": -0.276, "test_sharpe": 0.186, "test_tstat": 0.535, "test_p": 0.2965, "turnover": 0.016, "bh_pass": false, "dsr": NaN}, {"code": "12", "name": "tsmom", "full_sharpe": 0.238, "test_sharpe": 0.152, "test_tstat": 0.437, "test_p": 0.3311, "turnover": 0.0135, "bh_pass": false, "dsr": NaN}, {"code": "04", "name": "low_volatility", "full_sharpe": 0.038, "test_sharpe": 0.125, "test_tstat": 0.359, "test_p": 0.3599, "turnover": 0.0075, "bh_pass": false, "dsr": NaN}, {"code": "13", "name": "donchian", "full_sharpe": 0.262, "test_sharpe": 0.121, "test_tstat": 0.348, "test_p": 0.3638, "turnover": 0.0087, "bh_pass": false, "dsr": NaN}, {"code": "10", "name": "seasonality", "full_sharpe": -0.109, "test_sharpe": 0.064, "test_tstat": 0.183, "test_p": 0.4274, "turnover": 0.0564, "bh_pass": false, "dsr": NaN}, {"code": "08", "name": "skewness", "full_sharpe": 0.027, "test_sharpe": 0.032, "test_tstat": 0.093, "test_p": 0.463, "turnover": 0.0166, "bh_pass": false, "dsr": NaN}, {"code": "19", "name": "pairs", "full_sharpe": 0.0, "test_sharpe": 0.0, "test_tstat": 0.0, "test_p": 0.5, "turnover": 0.0, "bh_pass": false, "dsr": 0.0}, {"code": "29", "name": "parkinson_lowrange", "full_sharpe": -0.085, "test_sharpe": -0.053, "test_tstat": -0.153, "test_p": 0.5609, "turnover": 0.0267, "bh_pass": false, "dsr": NaN}, {"code": "28", "name": "low_52w", "full_sharpe": 0.112, "test_sharpe": -0.097, "test_tstat": -0.279, "test_p": 0.6097, "turnover": 0.0207, "bh_pass": false, "dsr": NaN}, {"code": "07", "name": "high_52w", "full_sharpe": -0.064, "test_sharpe": -0.099, "test_tstat": -0.283, "test_p": 0.6114, "turnover": 0.0275, "bh_pass": false, "dsr": NaN}, {"code": "11", "name": "downside_beta", "full_sharpe": 0.043, "test_sharpe": -0.115, "test_tstat": -0.33, "test_p": 0.6293, "turnover": 0.0102, "bh_pass": false, "dsr": NaN}, {"code": "25", "name": "bab_beta", "full_sharpe": -0.104, "test_sharpe": -0.135, "test_tstat": -0.386, "test_p": 0.6504, "turnover": 0.0076, "bh_pass": false, "dsr": NaN}, {"code": "32", "name": "volume_momentum", "full_sharpe": 0.071, "test_sharpe": -0.178, "test_tstat": -0.51, "test_p": 0.695, "turnover": 0.0543, "bh_pass": false, "dsr": NaN}, {"code": "06", "name": "max_lottery", "full_sharpe": -0.32, "test_sharpe": -0.289, "test_tstat": -0.829, "test_p": 0.7964, "turnover": 0.0485, "bh_pass": false, "dsr": NaN}, {"code": "03", "name": "long_term_reversal", "full_sharpe": -0.212, "test_sharpe": -0.519, "test_tstat": -1.49, "test_p": 0.9318, "turnover": 0.0082, "bh_pass": false, "dsr": NaN}, {"code": "18", "name": "bollinger", "full_sharpe": -0.997, "test_sharpe": -1.244, "test_tstat": -3.573, "test_p": 0.9998, "turnover": 0.2263, "bh_pass": false, "dsr": NaN}, {"code": "01", "name": "short_term_reversal", "full_sharpe": -1.757, "test_sharpe": -2.143, "test_tstat": -6.154, "test_p": 1.0, "turnover": 0.2703, "bh_pass": false, "dsr": NaN}, {"code": "17", "name": "overnight_intraday", "full_sharpe": -2.593, "test_sharpe": -2.541, "test_tstat": -7.296, "test_p": 1.0, "turnover": 0.2622, "bh_pass": false, "dsr": NaN}], "survivors": [], "status": "success"}
{"timestamp": "2026-07-07T14:20:40Z", "git_commit": "e5916a6", "git_dirty": true, "hypothesis_ref": "RL-2026-07-09", "universe": "NSE12", "sample_start": "2011-08-04", "sample_end": "2026-07-07", "n_assets": 12, "split": "2018-01-01", "cost_bps": 20.0, "strategy": "anomaly_replication_32", "n_trials": 32, "metrics": [{"code": "22", "name": "hrp", "full_sharpe": 0.881, "test_sharpe": 0.787, "test_tstat": 2.26, "test_p": 0.012, "turnover": 0.0058, "bh_pass": false, "dsr": 0.016}, {"code": "20", "name": "risk_parity_erc", "full_sharpe": 0.842, "test_sharpe": 0.754, "test_tstat": 2.164, "test_p": 0.0153, "turnover": 0.0024, "bh_pass": false, "dsr": 0.012}, {"code": "21", "name": "max_diversification", "full_sharpe": 0.823, "test_sharpe": 0.741, "test_tstat": 2.127, "test_p": 0.0168, "turnover": 0.0059, "bh_pass": false, "dsr": 0.011}, {"code": "15", "name": "vol_managed", "full_sharpe": 0.749, "test_sharpe": 0.69, "test_tstat": 1.982, "test_p": 0.0238, "turnover": 0.0095, "bh_pass": false, "dsr": 0.008}, {"code": "23", "name": "min_correlation", "full_sharpe": 0.761, "test_sharpe": 0.668, "test_tstat": 1.919, "test_p": 0.0276, "turnover": 0.0021, "bh_pass": false, "dsr": 0.006}, {"code": "24", "name": "dual_mom_erc", "full_sharpe": 0.653, "test_sharpe": 0.514, "test_tstat": 1.476, "test_p": 0.07, "turnover": 0.0186, "bh_pass": false, "dsr": 0.002}, {"code": "14", "name": "dual_momentum", "full_sharpe": 0.641, "test_sharpe": 0.486, "test_tstat": 1.394, "test_p": 0.0817, "turnover": 0.0194, "bh_pass": false, "dsr": 0.001}, {"code": "16", "name": "crash_scaled_tsmom", "full_sharpe": 0.433, "test_sharpe": 0.309, "test_tstat": 0.888, "test_p": 0.1874, "turnover": 0.0273, "bh_pass": false, "dsr": 0.0}, {"code": "26", "name": "sharpe_momentum", "full_sharpe": 0.167, "test_sharpe": 0.29, "test_tstat": 0.833, "test_p": 0.2026, "turnover": 0.0184, "bh_pass": false, "dsr": 0.0}, {"code": "09", "name": "residual_momentum", "full_sharpe": 0.046, "test_sharpe": 0.284, "test_tstat": 0.815, "test_p": 0.2075, "turnover": 0.0165, "bh_pass": false, "dsr": 0.0}, {"code": "05", "name": "idio_vol", "full_sharpe": 0.184, "test_sharpe": 0.277, "test_tstat": 0.797, "test_p": 0.2129, "turnover": 0.0058, "bh_pass": false, "dsr": 0.0}, {"code": "30", "name": "turn_of_month", "full_sharpe": 0.117, "test_sharpe": 0.243, "test_tstat": 0.696, "test_p": 0.2431, "turnover": 0.0985, "bh_pass": false, "dsr": 0.0}, {"code": "31", "name": "ma_trend", "full_sharpe": 0.283, "test_sharpe": 0.195, "test_tstat": 0.559, "test_p": 0.288, "turnover": 0.0202, "bh_pass": false, "dsr": 0.0}, {"code": "02", "name": "momentum_12_1", "full_sharpe": 0.019, "test_sharpe": 0.191, "test_tstat": 0.547, "test_p": 0.2921, "turnover": 0.0182, "bh_pass": false, "dsr": 0.0}, {"code": "27", "name": "kurtosis", "full_sharpe": -0.276, "test_sharpe": 0.186, "test_tstat": 0.535, "test_p": 0.2965, "turnover": 0.016, "bh_pass": false, "dsr": 0.0}, {"code": "12", "name": "tsmom", "full_sharpe": 0.238, "test_sharpe": 0.152, "test_tstat": 0.437, "test_p": 0.3311, "turnover": 0.0135, "bh_pass": false, "dsr": 0.0}, {"code": "04", "name": "low_volatility", "full_sharpe": 0.038, "test_sharpe": 0.125, "test_tstat": 0.359, "test_p": 0.3599, "turnover": 0.0075, "bh_pass": false, "dsr": 0.0}, {"code": "13", "name": "donchian", "full_sharpe": 0.262, "test_sharpe": 0.121, "test_tstat": 0.348, "test_p": 0.3638, "turnover": 0.0087, "bh_pass": false, "dsr": 0.0}, {"code": "10", "name": "seasonality", "full_sharpe": -0.109, "test_sharpe": 0.064, "test_tstat": 0.183, "test_p": 0.4274, "turnover": 0.0564, "bh_pass": false, "dsr": 0.0}, {"code": "08", "name": "skewness", "full_sharpe": 0.027, "test_sharpe": 0.032, "test_tstat": 0.093, "test_p": 0.463, "turnover": 0.0166, "bh_pass": false, "dsr": 0.0}, {"code": "19", "name": "pairs", "full_sharpe": 0.0, "test_sharpe": 0.0, "test_tstat": 0.0, "test_p": 0.5, "turnover": 0.0, "bh_pass": false, "dsr": 0.0}, {"code": "29", "name": "parkinson_lowrange", "full_sharpe": -0.085, "test_sharpe": -0.053, "test_tstat": -0.153, "test_p": 0.5609, "turnover": 0.0267, "bh_pass": false, "dsr": 0.0}, {"code": "28", "name": "low_52w", "full_sharpe": 0.112, "test_sharpe": -0.097, "test_tstat": -0.279, "test_p": 0.6097, "turnover": 0.0207, "bh_pass": false, "dsr": 0.0}, {"code": "07", "name": "high_52w", "full_sharpe": -0.064, "test_sharpe": -0.099, "test_tstat": -0.283, "test_p": 0.6114, "turnover": 0.0275, "bh_pass": false, "dsr": 0.0}, {"code": "11", "name": "downside_beta", "full_sharpe": 0.043, "test_sharpe": -0.115, "test_tstat": -0.33, "test_p": 0.6293, "turnover": 0.0102, "bh_pass": false, "dsr": 0.0}, {"code": "25", "name": "bab_beta", "full_sharpe": -0.104, "test_sharpe": -0.135, "test_tstat": -0.386, "test_p": 0.6504, "turnover": 0.0076, "bh_pass": false, "dsr": 0.0}, {"code": "32", "name": "volume_momentum", "full_sharpe": 0.071, "test_sharpe": -0.178, "test_tstat": -0.51, "test_p": 0.695, "turnover": 0.0543, "bh_pass": false, "dsr": 0.0}, {"code": "06", "name": "max_lottery", "full_sharpe": -0.32, "test_sharpe": -0.289, "test_tstat": -0.829, "test_p": 0.7964, "turnover": 0.0485, "bh_pass": false, "dsr": 0.0}, {"code": "03", "name": "long_term_reversal", "full_sharpe": -0.212, "test_sharpe": -0.519, "test_tstat": -1.49, "test_p": 0.9318, "turnover": 0.0082, "bh_pass": false, "dsr": 0.0}, {"code": "18", "name": "bollinger", "full_sharpe": -0.997, "test_sharpe": -1.244, "test_tstat": -3.573, "test_p": 0.9998, "turnover": 0.2263, "bh_pass": false, "dsr": 0.0}, {"code": "01", "name": "short_term_reversal", "full_sharpe": -1.757, "test_sharpe": -2.143, "test_tstat": -6.154, "test_p": 1.0, "turnover": 0.2703, "bh_pass": false, "dsr": 0.0}, {"code": "17", "name": "overnight_intraday", "full_sharpe": -2.593, "test_sharpe": -2.541, "test_tstat": -7.296, "test_p": 1.0, "turnover": 0.2622, "bh_pass": false, "dsr": 0.0}], "survivors": [], "status": "success"}
{"timestamp": "2026-07-08T22:21:22Z", "git_commit": "4937904", "git_dirty": true, "hypothesis_ref": "RL-2026-07-10", "universe": "NIFTY200", "sample_start": "2010-01-04", "sample_end": "2026-07-07", "n_assets": 133, "split": "2017-01-01", "cost_bps": 20.0, "strategy": "india_anomaly_replication_31", "n_trials": 31, "metrics": [{"code": "22", "name": "hrp", "full_sharpe": 1.515, "train_sharpe": 1.542, "train_tstat": 4.014, "test_sharpe": 1.51, "test_tstat": 4.606, "test_p": 0.0, "turnover": 0.0089, "bh_pass": true, "dsr": 0.118}, {"code": "20", "name": "risk_parity_erc", "full_sharpe": 1.385, "train_sharpe": 1.31, "train_tstat": 3.41, "test_sharpe": 1.435, "test_tstat": 4.377, "test_p": 0.0, "turnover": 0.0041, "bh_pass": true, "dsr": 0.08}, {"code": "24", "name": "dual_mom_erc", "full_sharpe": 1.464, "train_sharpe": 1.559, "train_tstat": 4.058, "test_sharpe": 1.431, "test_tstat": 4.363, "test_p": 0.0, "turnover": 0.0167, "bh_pass": true, "dsr": 0.079}, {"code": "15", "name": "vol_managed", "full_sharpe": 1.331, "train_sharpe": 1.213, "train_tstat": 3.159, "test_sharpe": 1.405, "test_tstat": 4.286, "test_p": 0.0, "turnover": 0.0139, "bh_pass": true, "dsr": 0.068}, {"code": "14", "name": "dual_momentum", "full_sharpe": 1.354, "train_sharpe": 1.367, "train_tstat": 3.56, "test_sharpe": 1.361, "test_tstat": 4.15, "test_p": 0.0, "turnover": 0.0176, "bh_pass": true, "dsr": 0.053}, {"code": "23", "name": "min_correlation", "full_sharpe": 1.218, "train_sharpe": 1.045, "train_tstat": 2.72, "test_sharpe": 1.327, "test_tstat": 4.046, "test_p": 0.0, "turnover": 0.0032, "bh_pass": true, "dsr": 0.042}, {"code": "16", "name": "crash_scaled_tsmom", "full_sharpe": 0.575, "train_sharpe": 0.38, "train_tstat": 0.988, "test_sharpe": 0.702, "test_tstat": 2.14, "test_p": 0.0162, "turnover": 0.0389, "bh_pass": true, "dsr": 0.0}, {"code": "12", "name": "tsmom", "full_sharpe": 0.554, "train_sharpe": 0.478, "train_tstat": 1.245, "test_sharpe": 0.603, "test_tstat": 1.838, "test_p": 0.0331, "turnover": 0.0164, "bh_pass": false, "dsr": 0.0}, {"code": "13", "name": "donchian", "full_sharpe": 0.599, "train_sharpe": 0.645, "train_tstat": 1.679, "test_sharpe": 0.581, "test_tstat": 1.771, "test_p": 0.0384, "turnover": 0.0103, "bh_pass": false, "dsr": 0.0}, {"code": "31", "name": "ma_trend", "full_sharpe": 0.457, "train_sharpe": 0.324, "train_tstat": 0.844, "test_sharpe": 0.544, "test_tstat": 1.658, "test_p": 0.0487, "turnover": 0.0205, "bh_pass": false, "dsr": 0.0}, {"code": "09", "name": "residual_momentum", "full_sharpe": 0.525, "train_sharpe": 0.594, "train_tstat": 1.546, "test_sharpe": 0.483, "test_tstat": 1.472, "test_p": 0.0706, "turnover": 0.0166, "bh_pass": false, "dsr": 0.0}, {"code": "30", "name": "turn_of_month", "full_sharpe": 0.418, "train_sharpe": 0.341, "train_tstat": 0.889, "test_sharpe": 0.472, "test_tstat": 1.439, "test_p": 0.0752, "turnover": 0.0994, "bh_pass": false, "dsr": 0.0}, {"code": "28", "name": "low_52w", "full_sharpe": 0.379, "train_sharpe": 0.421, "train_tstat": 1.097, "test_sharpe": 0.359, "test_tstat": 1.096, "test_p": 0.1367, "turnover": 0.0201, "bh_pass": false, "dsr": 0.0}, {"code": "26", "name": "sharpe_momentum", "full_sharpe": 0.389, "train_sharpe": 0.591, "train_tstat": 1.54, "test_sharpe": 0.248, "test_tstat": 0.758, "test_p": 0.2244, "turnover": 0.0187, "bh_pass": false, "dsr": 0.0}, {"code": "32", "name": "volume_momentum", "full_sharpe": 0.186, "train_sharpe": 0.103, "train_tstat": 0.267, "test_sharpe": 0.236, "test_tstat": 0.72, "test_p": 0.2359, "turnover": 0.0608, "bh_pass": false, "dsr": 0.0}, {"code": "02", "name": "momentum_12_1", "full_sharpe": 0.309, "train_sharpe": 0.494, "train_tstat": 1.285, "test_sharpe": 0.187, "test_tstat": 0.57, "test_p": 0.2843, "turnover": 0.0179, "bh_pass": false, "dsr": 0.0}, {"code": "19", "name": "pairs", "full_sharpe": 0.0, "train_sharpe": 0.0, "train_tstat": 0.0, "test_sharpe": 0.0, "test_tstat": 0.0, "test_p": 0.5, "turnover": 0.0, "bh_pass": false, "dsr": 0.0}, {"code": "25", "name": "bab_beta", "full_sharpe": 0.22, "train_sharpe": 0.569, "train_tstat": 1.48, "test_sharpe": -0.041, "test_tstat": -0.126, "test_p": 0.55, "turnover": 0.0088, "bh_pass": false, "dsr": 0.0}, {"code": "03", "name": "long_term_reversal", "full_sharpe": -0.137, "train_sharpe": -0.208, "train_tstat": -0.542, "test_sharpe": -0.116, "test_tstat": -0.353, "test_p": 0.638, "turnover": 0.0072, "bh_pass": false, "dsr": 0.0}, {"code": "27", "name": "kurtosis", "full_sharpe": -0.705, "train_sharpe": -1.231, "train_tstat": -3.206, "test_sharpe": -0.372, "test_tstat": -1.135, "test_p": 0.8717, "turnover": 0.0137, "bh_pass": false, "dsr": 0.0}, {"code": "11", "name": "downside_beta", "full_sharpe": -0.103, "train_sharpe": 0.272, "train_tstat": 0.708, "test_sharpe": -0.399, "test_tstat": -1.216, "test_p": 0.8879, "turnover": 0.0123, "bh_pass": false, "dsr": 0.0}, {"code": "10", "name": "seasonality", "full_sharpe": -0.271, "train_sharpe": -0.013, "train_tstat": -0.034, "test_sharpe": -0.442, "test_tstat": -1.348, "test_p": 0.9111, "turnover": 0.0602, "bh_pass": false, "dsr": 0.0}, {"code": "08", "name": "skewness", "full_sharpe": -0.989, "train_sharpe": -1.716, "train_tstat": -4.468, "test_sharpe": -0.564, "test_tstat": -1.721, "test_p": 0.9573, "turnover": 0.0141, "bh_pass": false, "dsr": 0.0}, {"code": "07", "name": "high_52w", "full_sharpe": -0.374, "train_sharpe": -0.005, "train_tstat": -0.013, "test_sharpe": -0.627, "test_tstat": -1.912, "test_p": 0.972, "turnover": 0.0275, "bh_pass": false, "dsr": 0.0}, {"code": "06", "name": "max_lottery", "full_sharpe": -0.618, "train_sharpe": -0.5, "train_tstat": -1.303, "test_sharpe": -0.701, "test_tstat": -2.137, "test_p": 0.9836, "turnover": 0.0541, "bh_pass": false, "dsr": 0.0}, {"code": "29", "name": "parkinson_lowrange", "full_sharpe": -0.741, "train_sharpe": -0.666, "train_tstat": -1.734, "test_sharpe": -0.789, "test_tstat": -2.407, "test_p": 0.9919, "turnover": 0.0346, "bh_pass": false, "dsr": 0.0}, {"code": "04", "name": "low_volatility", "full_sharpe": -0.516, "train_sharpe": -0.085, "train_tstat": -0.221, "test_sharpe": -0.801, "test_tstat": -2.443, "test_p": 0.9927, "turnover": 0.0082, "bh_pass": false, "dsr": 0.0}, {"code": "05", "name": "idio_vol", "full_sharpe": -0.717, "train_sharpe": -0.369, "train_tstat": -0.96, "test_sharpe": -0.916, "test_tstat": -2.793, "test_p": 0.9974, "turnover": 0.0076, "bh_pass": false, "dsr": 0.0}, {"code": "17", "name": "overnight_intraday", "full_sharpe": -1.343, "train_sharpe": -1.542, "train_tstat": -4.014, "test_sharpe": -1.245, "test_tstat": -3.798, "test_p": 0.9999, "turnover": 0.2607, "bh_pass": false, "dsr": 0.0}, {"code": "01", "name": "short_term_reversal", "full_sharpe": -1.195, "train_sharpe": -0.724, "train_tstat": -1.885, "test_sharpe": -1.538, "test_tstat": -4.69, "test_p": 1.0, "turnover": 0.2771, "bh_pass": false, "dsr": 0.0}, {"code": "18", "name": "bollinger", "full_sharpe": -1.527, "train_sharpe": -1.087, "train_tstat": -2.83, "test_sharpe": -1.832, "test_tstat": -5.588, "test_p": 1.0, "turnover": 0.3904, "bh_pass": false, "dsr": 0.0}], "survivors": [], "status": "success"}
