{"timestamp": "2026-06-24T12:51:24Z", "git_commit": "5913bcd", "git_dirty": true, "hypothesis_ref": "RL-2026-06-24-01", "split": "train", "config": {"lookback": 63, "mode": "gate", "backbone": "min_variance", "vol_target": 0.1, "vol_window": 63, "max_gross": 1.5, "rebalance": "2ME"}, "objective_J": 0.7235634857241016, "metrics": {"J": 0.7235634857241016, "sharpe": 0.9173630731378388, "sortino": 1.2171541034320983, "calmar": 0.3658064441055485, "ann_return": 0.07212379221514209, "ann_vol": 0.07935932001640876, "max_drawdown": -0.19716380992548, "turnover": 6.608778841690425, "fold_sharpes": {"2007": 1.8042982084212664, "2008": 0.293729871772476, "2009": 1.2119735114555974, "2010": 2.2794373848509903, "2011": 1.9688369118639253, "2012": 2.134711348162314, "2013": 0.09845722173568812, "2014": 1.581660508046788, "2015": -0.7560900238866193, "2016": 0.5473915471460659, "2017": 1.8968598495611066, "2018": 0.5144524597286515, "2019": 2.11667536739263}, "constraint_ok": true}, "status": "keep", "note": "champ + 2ME"}
{"timestamp": "2026-06-24T12:52:55Z", "git_commit": "5913bcd", "git_dirty": true, "hypothesis_ref": "RL-2026-06-24-01", "split": "oos", "config": {"lookback": 63, "mode": "gate", "backbone": "min_variance", "vol_target": 0.1, "vol_window": 63, "max_gross": 1.5, "rebalance": "ME"}, "metrics": {"J": 0.455120980181354, "sharpe": 0.6592508043614154, "sortino": 0.8220406649289663, "calmar": 0.3983476184138292, "ann_return": 0.056881621190802756, "ann_vol": 0.09009209951292901, "max_drawdown": -0.14279392812061564, "turnover": 10.406182482069902, "fold_sharpes": {"2020": 2.3179909700423225, "2021": 0.5621976595106891, "2022": -0.04745325956095432, "2023": 0.43409478164813325, "2024": 0.7060979340500888, "2025": 0.9774057052848995, "2026": 0.8112833910267027}, "constraint_ok": true}, "status": "final", "note": "OOS touch-once"}
{"timestamp": "2026-06-24T13:09:39Z", "git_commit": "eed5a33", "git_dirty": true, "hypothesis_ref": "RL-2026-06-24-01", "split": "train", "config": {"signal": "trend", "lookback": 63, "horizon": 21, "max_depth": 3, "learning_rate": 0.05, "n_estimators": 200, "mode": "gate", "backbone": "min_variance", "vol_target": 0.1, "vol_window": 63, "max_gross": 1.5, "rebalance": "ME"}, "objective_J": 0.017427416242764747, "metrics": {"J": 0.017427416242764747, "sharpe": 1.0714445969187782, "sharpe_ew": 0.6218673323055871, "sharpe_6040": 0.7614535689197587, "ir_vs_bench": 0.017427416242764747, "beats_both": true, "sortino": 1.4265408376611448, "calmar": 0.45617836034031223, "ann_return": 0.08417614028978582, "ann_vol": 0.07830637195540022, "max_drawdown": -0.18452462371733247, "turnover": 9.981547261859902, "constraint_ok": true}, "status": "keep", "note": "trend L63 minvar (champ)"}
{"timestamp": "2026-06-24T13:09:41Z", "git_commit": "eed5a33", "git_dirty": true, "hypothesis_ref": "RL-2026-06-24-01", "split": "train", "config": {"signal": "trend", "lookback": 63, "horizon": 21, "max_depth": 3, "learning_rate": 0.05, "n_estimators": 200, "mode": "gate", "backbone": "inverse_vol", "vol_target": 0.1, "vol_window": 63, "max_gross": 1.5, "rebalance": "ME"}, "objective_J": 0.1587575451087808, "metrics": {"J": 0.1587575451087808, "sharpe": 1.065664958891229, "sharpe_ew": 0.6218673323055871, "sharpe_6040": 0.7614535689197587, "ir_vs_bench": 0.1587575451087808, "beats_both": true, "sortino": 1.4351471542996246, "calmar": 0.5370151608062435, "ann_return": 0.10043568423229665, "ann_vol": 0.09397386430960976, "max_drawdown": -0.18702578914440393, "turnover": 7.654031435878092, "constraint_ok": true}, "status": "keep", "note": "trend L63 invvol"}
{"timestamp": "2026-06-24T13:09:46Z", "git_commit": "eed5a33", "git_dirty": true, "hypothesis_ref": "RL-2026-06-24-01", "split": "train", "config": {"signal": "trend", "lookback": 126, "horizon": 21, "max_depth": 3, "learning_rate": 0.05, "n_estimators": 200, "mode": "gate", "backbone": "min_variance", "vol_target": 0.1, "vol_window": 63, "max_gross": 1.5, "rebalance": "ME"}, "objective_J": -0.0074683815394806065, "metrics": {"J": -0.0074683815394806065, "sharpe": 1.0853119644855926, "sharpe_ew": 0.6218673323055871, "sharpe_6040": 0.7614535689197587, "ir_vs_bench": -0.0074683815394806065, "beats_both": true, "sortino": 1.42978734476294, "calmar": 0.6414394603010997, "ann_return": 0.08135139442601935, "ann_vol": 0.0746423548702169, "max_drawdown": -0.12682630156216457, "turnover": 8.283206663404023, "constraint_ok": true}, "status": "discard", "note": "trend L126 minvar"}
{"timestamp": "2026-06-24T13:09:48Z", "git_commit": "eed5a33", "git_dirty": true, "hypothesis_ref": "RL-2026-06-24-01", "split": "train", "config": {"signal": "trend", "lookback": 63, "horizon": 21, "max_depth": 3, "learning_rate": 0.05, "n_estimators": 200, "mode": "tilt", "backbone": "min_variance", "vol_target": 0.1, "vol_window": 63, "max_gross": 1.5, "rebalance": "ME"}, "objective_J": 0.018867656835691467, "metrics": {"J": 0.018867656835691467, "sharpe": 0.7671622107661528, "sharpe_ew": 0.6218673323055871, "sharpe_6040": 0.7614535689197587, "ir_vs_bench": 0.018867656835691467, "beats_both": true, "sortino": 1.0264874825983126, "calmar": 0.29314830053932905, "ann_return": 0.08134492192926945, "ann_vol": 0.10983190819815492, "max_drawdown": -0.27748727104885995, "turnover": 8.187622559810757, "constraint_ok": false}, "status": "discard", "note": "trend tilt"}
{"timestamp": "2026-06-24T13:09:53Z", "git_commit": "eed5a33", "git_dirty": true, "hypothesis_ref": "RL-2026-06-24-01", "split": "train", "config": {"signal": "trend", "lookback": 63, "horizon": 21, "max_depth": 3, "learning_rate": 0.05, "n_estimators": 200, "mode": "gate", "backbone": "min_variance", "vol_target": 0.15, "vol_window": 63, "max_gross": 2.0, "rebalance": "ME"}, "objective_J": 0.24528058238381373, "metrics": {"J": 0.24528058238381373, "sharpe": 1.043004944928063, "sharpe_ew": 0.6218673323055871, "sharpe_6040": 0.7614535689197587, "ir_vs_bench": 0.24528058238381373, "beats_both": true, "sortino": 1.3783712513739668, "calmar": 0.4402014860977441, "ann_return": 0.1151555142180325, "ann_vol": 0.11036587273631784, "max_drawdown": -0.2615972863673225, "turnover": 13.644006338039587, "constraint_ok": false}, "status": "discard", "note": "trend hi-risk"}
{"timestamp": "2026-06-24T13:09:59Z", "git_commit": "eed5a33", "git_dirty": true, "hypothesis_ref": "RL-2026-06-24-01", "split": "train", "config": {"signal": "trend", "lookback": 21, "horizon": 21, "max_depth": 3, "learning_rate": 0.05, "n_estimators": 200, "mode": "gate", "backbone": "min_variance", "vol_target": 0.1, "vol_window": 63, "max_gross": 1.5, "rebalance": "ME"}, "objective_J": -0.39525144773943954, "metrics": {"J": -0.39525144773943954, "sharpe": 0.47771957150476047, "sharpe_ew": 0.6218673323055871, "sharpe_6040": 0.7614535689197587, "ir_vs_bench": -0.39525144773943954, "beats_both": false, "sortino": 0.6155529626937496, "calmar": 0.16514771760737335, "ann_return": 0.035516771007995995, "ann_vol": 0.07972261333040499, "max_drawdown": -0.2150606228324301, "turnover": 16.606975088381677, "constraint_ok": false}, "status": "discard", "note": "trend L21 minvar"}
{"timestamp": "2026-06-24T13:10:37Z", "git_commit": "eed5a33", "git_dirty": true, "hypothesis_ref": "RL-2026-06-24-01", "split": "train", "config": {"signal": "ml", "lookback": 63, "horizon": 63, "max_depth": 3, "learning_rate": 0.05, "n_estimators": 200, "mode": "gate", "backbone": "min_variance", "vol_target": 0.1, "vol_window": 63, "max_gross": 1.5, "rebalance": "ME"}, "objective_J": -0.2809047667386811, "metrics": {"J": -0.2809047667386811, "sharpe": 0.7481804708497748, "sharpe_ew": 0.6218673323055871, "sharpe_6040": 0.7614535689197587, "ir_vs_bench": -0.2809047667386811, "beats_both": false, "sortino": 0.938014399966984, "calmar": 0.3155769691664412, "ann_return": 0.051647972593753755, "ann_vol": 0.07065299388055246, "max_drawdown": -0.16366204647371985, "turnover": 9.00517667797016, "constraint_ok": true}, "status": "discard", "note": "ml h63 gate minvar"}
{"timestamp": "2026-06-24T13:11:34Z", "git_commit": "eed5a33", "git_dirty": true, "hypothesis_ref": "RL-2026-06-24-01", "split": "train", "config": {"signal": "ml", "lookback": 63, "horizon": 21, "max_depth": 5, "learning_rate": 0.05, "n_estimators": 200, "mode": "gate", "backbone": "min_variance", "vol_target": 0.1, "vol_window": 63, "max_gross": 1.5, "rebalance": "ME"}, "objective_J": -0.4437440678200562, "metrics": {"J": -0.4437440678200562, "sharpe": 0.38881388432922526, "sharpe_ew": 0.6218673323055871, "sharpe_6040": 0.7614535689197587, "ir_vs_bench": -0.4437440678200562, "beats_both": false, "sortino": 0.3950873977137983, "calmar": 0.11812520215455125, "ann_return": 0.03245414042355654, "ann_vol": 0.09354325951401163, "max_drawdown": -0.27474357572818864, "turnover": 10.664135536244329, "constraint_ok": false}, "status": "discard", "note": "ml h21 d5"}
{"timestamp": "2026-06-24T13:12:04Z", "git_commit": "eed5a33", "git_dirty": true, "hypothesis_ref": "RL-2026-06-24-01", "split": "train", "config": {"signal": "ml", "lookback": 63, "horizon": 63, "max_depth": 3, "learning_rate": 0.05, "n_estimators": 200, "mode": "tilt", "backbone": "min_variance", "vol_target": 0.1, "vol_window": 63, "max_gross": 1.5, "rebalance": "ME"}, "objective_J": -0.217733463941502, "metrics": {"J": -0.217733463941502, "sharpe": 0.597386724449346, "sharpe_ew": 0.6218673323055871, "sharpe_6040": 0.7614535689197587, "ir_vs_bench": -0.217733463941502, "beats_both": false, "sortino": 0.751588532150058, "calmar": 0.2706447998866114, "ann_return": 0.0561169608633878, "ann_vol": 0.09974881651049966, "max_drawdown": -0.20734542428636504, "turnover": 7.063147912775506, "constraint_ok": true}, "status": "discard", "note": "ml h63 tilt"}
{"timestamp": "2026-06-24T13:12:36Z", "git_commit": "eed5a33", "git_dirty": true, "hypothesis_ref": "RL-2026-06-24-01", "split": "train", "config": {"signal": "trend", "lookback": 63, "horizon": 21, "max_depth": 3, "learning_rate": 0.05, "n_estimators": 200, "mode": "gate", "backbone": "inverse_vol", "vol_target": 0.12, "vol_window": 63, "max_gross": 1.5, "rebalance": "ME"}, "objective_J": 0.20480997847788313, "metrics": {"J": 0.20480997847788313, "sharpe": 1.0438675196657619, "sharpe_ew": 0.6218673323055871, "sharpe_6040": 0.7614535689197587, "ir_vs_bench": 0.20480997847788313, "beats_both": true, "sortino": 1.4098536829729007, "calmar": 0.5058692235708836, "ann_return": 0.10642931867042438, "ann_vol": 0.10188372300160972, "max_drawdown": -0.21038899721779825, "turnover": 8.162492747975707, "constraint_ok": true}, "status": "keep", "note": "invvol vt0.12"}
{"timestamp": "2026-06-24T13:12:38Z", "git_commit": "eed5a33", "git_dirty": true, "hypothesis_ref": "RL-2026-06-24-01", "split": "train", "config": {"signal": "trend", "lookback": 63, "horizon": 21, "max_depth": 3, "learning_rate": 0.05, "n_estimators": 200, "mode": "gate", "backbone": "inverse_vol", "vol_target": 0.12, "vol_window": 63, "max_gross": 2.0, "rebalance": "ME"}, "objective_J": 0.3663364193271649, "metrics": {"J": 0.3663364193271649, "sharpe": 1.0935405724836558, "sharpe_ew": 0.6218673323055871, "sharpe_6040": 0.7614535689197587, "ir_vs_bench": 0.3663364193271649, "beats_both": true, "sortino": 1.480339242451192, "calmar": 0.5726278501049145, "ann_return": 0.12967143928667957, "ann_vol": 0.11788765907455251, "max_drawdown": -0.22644976010671103, "turnover": 9.683191307285195, "constraint_ok": true}, "status": "keep", "note": "invvol vt0.12 g2.0"}
{"timestamp": "2026-06-24T13:12:39Z", "git_commit": "eed5a33", "git_dirty": true, "hypothesis_ref": "RL-2026-06-24-01", "split": "train", "config": {"signal": "trend", "lookback": 63, "horizon": 21, "max_depth": 3, "learning_rate": 0.05, "n_estimators": 200, "mode": "gate", "backbone": "inverse_vol", "vol_target": 0.1, "vol_window": 63, "max_gross": 2.0, "rebalance": "ME"}, "objective_J": 0.30741539571243454, "metrics": {"J": 0.30741539571243454, "sharpe": 1.1426786865307157, "sharpe_ew": 0.6218673323055871, "sharpe_6040": 0.7614535689197587, "ir_vs_bench": 0.30741539571243454, "beats_both": true, "sortino": 1.5653549352889111, "calmar": 0.6086690237659277, "ann_return": 0.1199297846646683, "ann_vol": 0.10387189396241112, "max_drawdown": -0.19703612305197415, "turnover": 8.834487035146253, "constraint_ok": true}, "status": "keep", "note": "invvol g2.0"}
{"timestamp": "2026-06-24T13:12:41Z", "git_commit": "eed5a33", "git_dirty": true, "hypothesis_ref": "RL-2026-06-24-01", "split": "train", "config": {"signal": "trend", "lookback": 42, "horizon": 21, "max_depth": 3, "learning_rate": 0.05, "n_estimators": 200, "mode": "gate", "backbone": "inverse_vol", "vol_target": 0.1, "vol_window": 63, "max_gross": 1.5, "rebalance": "ME"}, "objective_J": 0.04207528242579115, "metrics": {"J": 0.04207528242579115, "sharpe": 0.9407686947394232, "sharpe_ew": 0.6218673323055871, "sharpe_6040": 0.7614535689197587, "ir_vs_bench": 0.04207528242579115, "beats_both": true, "sortino": 1.2369875927495952, "calmar": 0.4565866118361845, "ann_return": 0.08580278599612101, "ann_vol": 0.09202513453411135, "max_drawdown": -0.1879222556506006, "turnover": 9.949818420922595, "constraint_ok": true}, "status": "keep", "note": "invvol L42"}
{"timestamp": "2026-06-24T13:12:42Z", "git_commit": "eed5a33", "git_dirty": true, "hypothesis_ref": "RL-2026-06-24-01", "split": "train", "config": {"signal": "trend", "lookback": 90, "horizon": 21, "max_depth": 3, "learning_rate": 0.05, "n_estimators": 200, "mode": "gate", "backbone": "inverse_vol", "vol_target": 0.1, "vol_window": 63, "max_gross": 1.5, "rebalance": "ME"}, "objective_J": -0.004597957423051431, "metrics": {"J": -0.004597957423051431, "sharpe": 0.9000520527377712, "sharpe_ew": 0.6218673323055871, "sharpe_6040": 0.7614535689197587, "ir_vs_bench": -0.004597957423051431, "beats_both": true, "sortino": 1.23752037296351, "calmar": 0.34312781888452537, "ann_return": 0.08031174295016608, "ann_vol": 0.09038081234663076, "max_drawdown": -0.23405780158324563, "turnover": 6.963100941042093, "constraint_ok": true}, "status": "discard", "note": "invvol L90"}
{"timestamp": "2026-06-24T13:12:44Z", "git_commit": "eed5a33", "git_dirty": true, "hypothesis_ref": "RL-2026-06-24-01", "split": "train", "config": {"signal": "trend", "lookback": 63, "horizon": 21, "max_depth": 3, "learning_rate": 0.05, "n_estimators": 200, "mode": "gate", "backbone": "inverse_vol", "vol_target": 0.1, "vol_window": 42, "max_gross": 1.5, "rebalance": "ME"}, "objective_J": 0.14149711678277224, "metrics": {"J": 0.14149711678277224, "sharpe": 1.0338494728865675, "sharpe_ew": 0.6218673323055871, "sharpe_6040": 0.7614535689197587, "ir_vs_bench": 0.14149711678277224, "beats_both": true, "sortino": 1.3918596689964395, "calmar": 0.5289160903036209, "ann_return": 0.09801528192557685, "ann_vol": 0.09481148201200501, "max_drawdown": -0.18531348114085888, "turnover": 7.912428876782811, "constraint_ok": true}, "status": "keep", "note": "invvol vw42"}
{"timestamp": "2026-06-24T13:12:46Z", "git_commit": "eed5a33", "git_dirty": true, "hypothesis_ref": "RL-2026-06-24-01", "split": "train", "config": {"signal": "trend", "lookback": 63, "horizon": 21, "max_depth": 3, "learning_rate": 0.05, "n_estimators": 200, "mode": "gate", "backbone": "inverse_vol", "vol_target": 0.1, "vol_window": 126, "max_gross": 1.5, "rebalance": "ME"}, "objective_J": 0.07626036775472365, "metrics": {"J": 0.07626036775472365, "sharpe": 0.9962623527415887, "sharpe_ew": 0.6218673323055871, "sharpe_6040": 0.7614535689197587, "ir_vs_bench": 0.07626036775472365, "beats_both": true, "sortino": 1.3183090582888368, "calmar": 0.5112392989060677, "ann_return": 0.09047443322300741, "ann_vol": 0.09112478942865834, "max_drawdown": -0.17697081076631138, "turnover": 7.086480593281408, "constraint_ok": true}, "status": "keep", "note": "invvol vw126"}
{"timestamp": "2026-06-24T13:12:47Z", "git_commit": "eed5a33", "git_dirty": true, "hypothesis_ref": "RL-2026-06-24-01", "split": "train", "config": {"signal": "trend", "lookback": 63, "horizon": 21, "max_depth": 3, "learning_rate": 0.05, "n_estimators": 200, "mode": "gate", "backbone": "inverse_vol", "vol_target": 0.1, "vol_window": 63, "max_gross": 1.5, "rebalance": "2ME"}, "objective_J": 0.06146189298485581, "metrics": {"J": 0.06146189298485581, "sharpe": 0.9515157266866663, "sharpe_ew": 0.6218673323055871, "sharpe_6040": 0.7614535689197587, "ir_vs_bench": 0.06146189298485581, "beats_both": true, "sortino": 1.3182073513238592, "calmar": 0.44955086723224275, "ann_return": 0.08776387626390925, "ann_vol": 0.09296915330508776, "max_drawdown": -0.19522568559203668, "turnover": 5.414797880483605, "constraint_ok": true}, "status": "keep", "note": "invvol 2ME"}
{"timestamp": "2026-06-24T13:13:26Z", "git_commit": "eed5a33", "git_dirty": true, "hypothesis_ref": "RL-2026-06-24-01", "split": "train", "config": {"signal": "trend", "lookback": 63, "horizon": 21, "max_depth": 3, "learning_rate": 0.05, "n_estimators": 200, "mode": "gate", "backbone": "inverse_vol", "vol_target": 0.15, "vol_window": 63, "max_gross": 2.0, "rebalance": "ME"}, "objective_J": 0.41743860444942815, "metrics": {"J": 0.41743860444942815, "sharpe": 1.054519116087948, "sharpe_ew": 0.6218673323055871, "sharpe_6040": 0.7614535689197587, "ir_vs_bench": 0.41743860444942815, "beats_both": true, "sortino": 1.42416468655478, "calmar": 0.533978162593669, "ann_return": 0.1396086926991169, "ann_vol": 0.1322673550235404, "max_drawdown": -0.261450191185725, "turnover": 10.644680451899022, "constraint_ok": false}, "status": "discard", "note": "champ+ vt0.15"}
{"timestamp": "2026-06-24T13:13:27Z", "git_commit": "eed5a33", "git_dirty": true, "hypothesis_ref": "RL-2026-06-24-01", "split": "train", "config": {"signal": "trend", "lookback": 42, "horizon": 21, "max_depth": 3, "learning_rate": 0.05, "n_estimators": 200, "mode": "gate", "backbone": "inverse_vol", "vol_target": 0.12, "vol_window": 63, "max_gross": 2.0, "rebalance": "ME"}, "objective_J": 0.24398373278994376, "metrics": {"J": 0.24398373278994376, "sharpe": 0.9604050417351613, "sharpe_ew": 0.6218673323055871, "sharpe_6040": 0.7614535689197587, "ir_vs_bench": 0.24398373278994376, "beats_both": true, "sortino": 1.250677488634927, "calmar": 0.468657639056234, "ann_return": 0.11137701673446054, "ann_vol": 0.11713859688043006, "max_drawdown": -0.23765112835618685, "turnover": 12.629716287669076, "constraint_ok": false}, "status": "discard", "note": "champ+ L42"}
{"timestamp": "2026-06-24T13:13:29Z", "git_commit": "eed5a33", "git_dirty": true, "hypothesis_ref": "RL-2026-06-24-01", "split": "train", "config": {"signal": "trend", "lookback": 90, "horizon": 21, "max_depth": 3, "learning_rate": 0.05, "n_estimators": 200, "mode": "gate", "backbone": "inverse_vol", "vol_target": 0.12, "vol_window": 63, "max_gross": 2.0, "rebalance": "ME"}, "objective_J": 0.19794748032576656, "metrics": {"J": 0.19794748032576656, "sharpe": 0.9258053205950613, "sharpe_ew": 0.6218673323055871, "sharpe_6040": 0.7614535689197587, "ir_vs_bench": 0.19794748032576656, "beats_both": true, "sortino": 1.2754235662258866, "calmar": 0.37500972356950996, "ann_return": 0.10440742010180792, "ann_vol": 0.11435592245507582, "max_drawdown": -0.2784125678342724, "turnover": 8.869837958896863, "constraint_ok": false}, "status": "discard", "note": "champ+ L90"}
{"timestamp": "2026-06-24T13:13:30Z", "git_commit": "eed5a33", "git_dirty": true, "hypothesis_ref": "RL-2026-06-24-01", "split": "train", "config": {"signal": "trend", "lookback": 126, "horizon": 21, "max_depth": 3, "learning_rate": 0.05, "n_estimators": 200, "mode": "gate", "backbone": "inverse_vol", "vol_target": 0.12, "vol_window": 63, "max_gross": 2.0, "rebalance": "ME"}, "objective_J": 0.2278466069552345, "metrics": {"J": 0.2278466069552345, "sharpe": 0.9638766966269708, "sharpe_ew": 0.6218673323055871, "sharpe_6040": 0.7614535689197587, "ir_vs_bench": 0.2278466069552345, "beats_both": true, "sortino": 1.2951077761386194, "calmar": 0.6606982494119674, "ann_return": 0.10805060370936981, "ann_vol": 0.11311273156043174, "max_drawdown": -0.16354001816341524, "turnover": 7.187307104725983, "constraint_ok": true}, "status": "keep", "note": "champ+ L126"}
{"timestamp": "2026-06-24T13:13:32Z", "git_commit": "eed5a33", "git_dirty": true, "hypothesis_ref": "RL-2026-06-24-01", "split": "train", "config": {"signal": "trend", "lookback": 63, "horizon": 21, "max_depth": 3, "learning_rate": 0.05, "n_estimators": 200, "mode": "gate", "backbone": "inverse_vol", "vol_target": 0.12, "vol_window": 42, "max_gross": 2.0, "rebalance": "ME"}, "objective_J": 0.3460466945524521, "metrics": {"J": 0.3460466945524521, "sharpe": 1.0562449652902433, "sharpe_ew": 0.6218673323055871, "sharpe_6040": 0.7614535689197587, "ir_vs_bench": 0.3460466945524521, "beats_both": true, "sortino": 1.4323353193146657, "calmar": 0.5646392813984711, "ann_return": 0.12609610741872213, "ann_vol": 0.11919357172578707, "max_drawdown": -0.2233215285808905, "turnover": 10.054304147907812, "constraint_ok": true}, "status": "keep", "note": "champ+ vw42"}
{"timestamp": "2026-06-24T13:13:33Z", "git_commit": "eed5a33", "git_dirty": true, "hypothesis_ref": "RL-2026-06-24-01", "split": "train", "config": {"signal": "trend", "lookback": 63, "horizon": 21, "max_depth": 3, "learning_rate": 0.05, "n_estimators": 200, "mode": "gate", "backbone": "inverse_vol", "vol_target": 0.12, "vol_window": 126, "max_gross": 2.0, "rebalance": "ME"}, "objective_J": 0.2601964662358185, "metrics": {"J": 0.2601964662358185, "sharpe": 1.0136548711362174, "sharpe_ew": 0.6218673323055871, "sharpe_6040": 0.7614535689197587, "ir_vs_bench": 0.2601964662358185, "beats_both": true, "sortino": 1.3408951556289195, "calmar": 0.53398558920369, "ann_return": 0.11527997684112967, "ann_vol": 0.11408990986092342, "max_drawdown": -0.2158859324519259, "turnover": 9.029783168990136, "constraint_ok": true}, "status": "keep", "note": "champ+ vw126"}
