{"timestamp": "2026-07-08T22:24:32Z", "git_commit": "2ed4d48", "git_dirty": true, "hypothesis_ref": "RL-2026-07-10", "universe": "NIFTY500", "sample_start": "2010-01-04", "sample_end": "2026-07-07", "n_assets": 277, "split": "2017-01-01", "cost_bps": 20.0, "strategy": "india_anomaly_replication_31", "n_trials": 31, "metrics": [{"code": "24", "name": "dual_mom_erc", "full_sharpe": 1.596, "train_sharpe": 1.701, "train_tstat": 4.43, "test_sharpe": 1.552, "test_tstat": 4.734, "test_p": 0.0, "turnover": 0.0173, "bh_pass": true, "dsr": 0.014}, {"code": "14", "name": "dual_momentum", "full_sharpe": 1.489, "train_sharpe": 1.536, "train_tstat": 3.999, "test_sharpe": 1.477, "test_tstat": 4.505, "test_p": 0.0, "turnover": 0.0186, "bh_pass": true, "dsr": 0.008}, {"code": "22", "name": "hrp", "full_sharpe": 1.442, "train_sharpe": 1.648, "train_tstat": 4.292, "test_sharpe": 1.409, "test_tstat": 4.299, "test_p": 0.0, "turnover": 0.0101, "bh_pass": true, "dsr": 0.001}, {"code": "15", "name": "vol_managed", "full_sharpe": 1.346, "train_sharpe": 1.277, "train_tstat": 3.324, "test_sharpe": 1.39, "test_tstat": 4.238, "test_p": 0.0, "turnover": 0.0154, "bh_pass": true, "dsr": 0.004}, {"code": "23", "name": "min_correlation", "full_sharpe": 1.292, "train_sharpe": 1.16, "train_tstat": 3.02, "test_sharpe": 1.377, "test_tstat": 4.198, "test_p": 0.0, "turnover": 0.0035, "bh_pass": true, "dsr": 0.003}, {"code": "20", "name": "risk_parity_erc", "full_sharpe": 1.333, "train_sharpe": 1.366, "train_tstat": 3.555, "test_sharpe": 1.359, "test_tstat": 4.144, "test_p": 0.0, "turnover": 0.0056, "bh_pass": true, "dsr": 0.001}, {"code": "28", "name": "low_52w", "full_sharpe": 0.925, "train_sharpe": 0.89, "train_tstat": 2.317, "test_sharpe": 0.956, "test_tstat": 2.915, "test_p": 0.0018, "turnover": 0.0199, "bh_pass": true, "dsr": 0.0}, {"code": "09", "name": "residual_momentum", "full_sharpe": 0.937, "train_sharpe": 0.94, "train_tstat": 2.446, "test_sharpe": 0.939, "test_tstat": 2.864, "test_p": 0.0021, "turnover": 0.0163, "bh_pass": true, "dsr": 0.0}, {"code": "16", "name": "crash_scaled_tsmom", "full_sharpe": 0.722, "train_sharpe": 0.48, "train_tstat": 1.248, "test_sharpe": 0.885, "test_tstat": 2.698, "test_p": 0.0035, "turnover": 0.0401, "bh_pass": true, "dsr": 0.0}, {"code": "12", "name": "tsmom", "full_sharpe": 0.675, "train_sharpe": 0.648, "train_tstat": 1.688, "test_sharpe": 0.696, "test_tstat": 2.123, "test_p": 0.0169, "turnover": 0.0169, "bh_pass": true, "dsr": 0.0}, {"code": "31", "name": "ma_trend", "full_sharpe": 0.632, "train_sharpe": 0.569, "train_tstat": 1.48, "test_sharpe": 0.675, "test_tstat": 2.058, "test_p": 0.0198, "turnover": 0.021, "bh_pass": true, "dsr": 0.0}, {"code": "13", "name": "donchian", "full_sharpe": 0.648, "train_sharpe": 0.685, "train_tstat": 1.784, "test_sharpe": 0.626, "test_tstat": 1.909, "test_p": 0.0282, "turnover": 0.011, "bh_pass": true, "dsr": 0.0}, {"code": "02", "name": "momentum_12_1", "full_sharpe": 0.67, "train_sharpe": 0.776, "train_tstat": 2.021, "test_sharpe": 0.602, "test_tstat": 1.835, "test_p": 0.0333, "turnover": 0.0176, "bh_pass": true, "dsr": 0.0}, {"code": "30", "name": "turn_of_month", "full_sharpe": 0.633, "train_sharpe": 0.734, "train_tstat": 1.912, "test_sharpe": 0.572, "test_tstat": 1.743, "test_p": 0.0407, "turnover": 0.0997, "bh_pass": true, "dsr": 0.0}, {"code": "26", "name": "sharpe_momentum", "full_sharpe": 0.701, "train_sharpe": 0.898, "train_tstat": 2.338, "test_sharpe": 0.563, "test_tstat": 1.716, "test_p": 0.0432, "turnover": 0.0185, "bh_pass": true, "dsr": 0.0}, {"code": "03", "name": "long_term_reversal", "full_sharpe": 0.274, "train_sharpe": -0.152, "train_tstat": -0.395, "test_sharpe": 0.465, "test_tstat": 1.417, "test_p": 0.0782, "turnover": 0.0071, "bh_pass": false, "dsr": 0.0}, {"code": "32", "name": "volume_momentum", "full_sharpe": 0.169, "train_sharpe": 0.124, "train_tstat": 0.323, "test_sharpe": 0.197, "test_tstat": 0.602, "test_p": 0.2736, "turnover": 0.0637, "bh_pass": false, "dsr": 0.0}, {"code": "19", "name": "pairs", "full_sharpe": 0.0, "train_sharpe": 0.0, "train_tstat": 0.0, "test_sharpe": 0.0, "test_tstat": 0.0, "test_p": 0.5, "turnover": 0.0, "bh_pass": false, "dsr": 0.0}, {"code": "25", "name": "bab_beta", "full_sharpe": 0.143, "train_sharpe": 0.554, "train_tstat": 1.443, "test_sharpe": -0.184, "test_tstat": -0.561, "test_p": 0.7126, "turnover": 0.0094, "bh_pass": false, "dsr": 0.0}, {"code": "27", "name": "kurtosis", "full_sharpe": -0.657, "train_sharpe": -1.231, "train_tstat": -3.205, "test_sharpe": -0.226, "test_tstat": -0.689, "test_p": 0.7546, "turnover": 0.0131, "bh_pass": false, "dsr": 0.0}, {"code": "07", "name": "high_52w", "full_sharpe": -0.207, "train_sharpe": 0.15, "train_tstat": 0.39, "test_sharpe": -0.445, "test_tstat": -1.356, "test_p": 0.9124, "turnover": 0.0263, "bh_pass": false, "dsr": 0.0}, {"code": "11", "name": "downside_beta", "full_sharpe": -0.197, "train_sharpe": 0.304, "train_tstat": 0.791, "test_sharpe": -0.604, "test_tstat": -1.843, "test_p": 0.9673, "turnover": 0.0126, "bh_pass": false, "dsr": 0.0}, {"code": "17", "name": "overnight_intraday", "full_sharpe": -1.42, "train_sharpe": -1.924, "train_tstat": -5.01, "test_sharpe": -1.115, "test_tstat": -3.4, "test_p": 0.9997, "turnover": 0.2501, "bh_pass": false, "dsr": 0.0}, {"code": "06", "name": "max_lottery", "full_sharpe": -0.912, "train_sharpe": -0.606, "train_tstat": -1.577, "test_sharpe": -1.126, "test_tstat": -3.435, "test_p": 0.9997, "turnover": 0.0527, "bh_pass": false, "dsr": 0.0}, {"code": "04", "name": "low_volatility", "full_sharpe": -0.921, "train_sharpe": -0.53, "train_tstat": -1.38, "test_sharpe": -1.174, "test_tstat": -3.581, "test_p": 0.9998, "turnover": 0.008, "bh_pass": false, "dsr": 0.0}, {"code": "10", "name": "seasonality", "full_sharpe": -0.816, "train_sharpe": -0.225, "train_tstat": -0.587, "test_sharpe": -1.212, "test_tstat": -3.697, "test_p": 0.9999, "turnover": 0.0612, "bh_pass": false, "dsr": 0.0}, {"code": "08", "name": "skewness", "full_sharpe": -1.281, "train_sharpe": -1.353, "train_tstat": -3.522, "test_sharpe": -1.24, "test_tstat": -3.783, "test_p": 0.9999, "turnover": 0.0131, "bh_pass": false, "dsr": 0.0}, {"code": "29", "name": "parkinson_lowrange", "full_sharpe": -1.107, "train_sharpe": -0.901, "train_tstat": -2.345, "test_sharpe": -1.245, "test_tstat": -3.796, "test_p": 0.9999, "turnover": 0.0339, "bh_pass": false, "dsr": 0.0}, {"code": "05", "name": "idio_vol", "full_sharpe": -1.141, "train_sharpe": -0.932, "train_tstat": -2.426, "test_sharpe": -1.274, "test_tstat": -3.884, "test_p": 0.9999, "turnover": 0.0075, "bh_pass": false, "dsr": 0.0}, {"code": "01", "name": "short_term_reversal", "full_sharpe": -1.437, "train_sharpe": -0.897, "train_tstat": -2.335, "test_sharpe": -1.853, "test_tstat": -5.652, "test_p": 1.0, "turnover": 0.2765, "bh_pass": false, "dsr": 0.0}, {"code": "18", "name": "bollinger", "full_sharpe": -2.019, "train_sharpe": -1.653, "train_tstat": -4.302, "test_sharpe": -2.271, "test_tstat": -6.927, "test_p": 1.0, "turnover": 0.3883, "bh_pass": false, "dsr": 0.0}], "survivors": [], "status": "success"}
{"timestamp": "2026-07-08T22:58:08Z", "git_commit": "4777e4e", "git_dirty": true, "hypothesis_ref": "RL-2026-07-10", "universe": "NIFTY500", "cost_bps": 20.0, "split": "2017-01-01", "strategy": "LO-CORE", "n_assets": 277, "metrics": {"strategy": "LO-CORE", "test_sharpe": 1.628, "test_tstat": 4.96, "ann_return": 0.276, "ann_vol": 0.1575, "max_dd": -0.2689, "turnover": 0.0241, "beats_nifty": true, "act_ret_tr": 0.1355, "act_t_tr": 1.92, "beta_tr": 0.492, "alpha_t_tr": 4.16, "act_ret_ew": 0.0201, "act_t_ew": 0.06, "beta_ew": 0.628, "alpha_t_ew": 2.86, "beats_ew": false, "bull_sharpe": 1.732, "bear_sharpe": 1.191, "hivol_sharpe": 1.973, "lovol_sharpe": 1.486, "feb_jun_2020": -0.0296, "sr_17_19": 0.991, "sr_20": 2.289, "sr_21_23": 2.3, "sr_24_26H1": 1.21}, "bh_pass": true, "dsr": 0.999, "n_trials_family": 9, "n_trials_cumulative": 41, "status": "success"}
{"timestamp": "2026-07-08T22:58:08Z", "git_commit": "4777e4e", "git_dirty": true, "hypothesis_ref": "RL-2026-07-10", "universe": "NIFTY500", "cost_bps": 20.0, "split": "2017-01-01", "strategy": "LO-CORE-NOOVERLAY", "n_assets": 277, "metrics": {"strategy": "LO-CORE-NOOVERLAY", "test_sharpe": 1.507, "test_tstat": 4.6, "ann_return": 0.319, "ann_vol": 0.1968, "max_dd": -0.3638, "turnover": 0.0253, "beats_nifty": true, "act_ret_tr": 0.1786, "act_t_tr": 3.48, "beta_tr": 0.922, "alpha_t_tr": 3.93, "act_ret_ew": 0.0631, "act_t_ew": 1.69, "beta_ew": 1.016, "alpha_t_ew": 2.07, "beats_ew": false, "bull_sharpe": 1.882, "bear_sharpe": 0.667, "hivol_sharpe": 1.683, "lovol_sharpe": 1.455, "feb_jun_2020": -0.1076, "sr_17_19": 1.644, "sr_20": 1.171, "sr_21_23": 2.358, "sr_24_26H1": 0.745}, "bh_pass": true, "dsr": 0.997, "n_trials_family": 9, "n_trials_cumulative": 41, "status": "success"}
{"timestamp": "2026-07-08T22:58:08Z", "git_commit": "4777e4e", "git_dirty": true, "hypothesis_ref": "RL-2026-07-10", "universe": "NIFTY500", "cost_bps": 20.0, "split": "2017-01-01", "strategy": "LO-EXT", "n_assets": 277, "metrics": {"strategy": "LO-EXT", "test_sharpe": 1.619, "test_tstat": 4.94, "ann_return": 0.2857, "ann_vol": 0.1636, "max_dd": -0.2757, "turnover": 0.0238, "beats_nifty": true, "act_ret_tr": 0.1452, "act_t_tr": 2.01, "beta_tr": 0.508, "alpha_t_tr": 4.13, "act_ret_ew": 0.0298, "act_t_ew": 0.21, "beta_ew": 0.655, "alpha_t_ew": 2.82, "beats_ew": false, "bull_sharpe": 1.724, "bear_sharpe": 1.18, "hivol_sharpe": 2.001, "lovol_sharpe": 1.464, "feb_jun_2020": -0.0295, "sr_17_19": 0.845, "sr_20": 2.381, "sr_21_23": 2.329, "sr_24_26H1": 1.24}, "bh_pass": true, "dsr": 0.999, "n_trials_family": 9, "n_trials_cumulative": 41, "status": "success"}
{"timestamp": "2026-07-08T22:58:08Z", "git_commit": "4777e4e", "git_dirty": true, "hypothesis_ref": "RL-2026-07-10", "universe": "NIFTY500", "cost_bps": 20.0, "split": "2017-01-01", "strategy": "LO-ERC", "n_assets": 277, "metrics": {"strategy": "LO-ERC", "test_sharpe": 1.696, "test_tstat": 5.17, "ann_return": 0.2798, "ann_vol": 0.1524, "max_dd": -0.2389, "turnover": 0.0234, "beats_nifty": true, "act_ret_tr": 0.1393, "act_t_tr": 1.97, "beta_tr": 0.471, "alpha_t_tr": 4.4, "act_ret_ew": 0.0239, "act_t_ew": 0.11, "beta_ew": 0.604, "alpha_t_ew": 3.17, "beats_ew": false, "bull_sharpe": 1.818, "bear_sharpe": 1.148, "hivol_sharpe": 2.011, "lovol_sharpe": 1.567, "feb_jun_2020": -0.0258, "sr_17_19": 1.124, "sr_20": 2.35, "sr_21_23": 2.399, "sr_24_26H1": 1.175}, "bh_pass": true, "dsr": 0.999, "n_trials_family": 9, "n_trials_cumulative": 41, "status": "success"}
{"timestamp": "2026-07-08T22:58:08Z", "git_commit": "4777e4e", "git_dirty": true, "hypothesis_ref": "RL-2026-07-10", "universe": "NIFTY500", "cost_bps": 20.0, "split": "2017-01-01", "strategy": "LO-VT", "n_assets": 277, "metrics": {"strategy": "LO-VT", "test_sharpe": 1.44, "test_tstat": 4.39, "ann_return": 0.2425, "ann_vol": 0.1598, "max_dd": -0.3067, "turnover": 0.0249, "beats_nifty": true, "act_ret_tr": 0.1021, "act_t_tr": 2.09, "beta_tr": 0.711, "alpha_t_tr": 3.53, "act_ret_ew": -0.0134, "act_t_ew": -0.53, "beta_ew": 0.805, "alpha_t_ew": 1.53, "beats_ew": false, "bull_sharpe": 1.844, "bear_sharpe": 0.358, "hivol_sharpe": 1.43, "lovol_sharpe": 1.459, "feb_jun_2020": -0.1421, "sr_17_19": 1.566, "sr_20": 1.119, "sr_21_23": 2.444, "sr_24_26H1": 0.401}, "bh_pass": true, "dsr": 0.995, "n_trials_family": 9, "n_trials_cumulative": 41, "status": "success"}
{"timestamp": "2026-07-08T22:58:08Z", "git_commit": "4777e4e", "git_dirty": true, "hypothesis_ref": "RL-2026-07-10", "universe": "NIFTY500", "cost_bps": 20.0, "split": "2017-01-01", "strategy": "REGIME", "n_assets": 277, "metrics": {"strategy": "REGIME", "test_sharpe": 1.698, "test_tstat": 5.18, "ann_return": 0.2991, "ann_vol": 0.162, "max_dd": -0.2188, "turnover": 0.0282, "beats_nifty": true, "act_ret_tr": 0.1587, "act_t_tr": 2.73, "beta_tr": 0.638, "alpha_t_tr": 4.49, "act_ret_ew": 0.0433, "act_t_ew": 0.52, "beta_ew": 0.75, "alpha_t_ew": 3.14, "beats_ew": false, "bull_sharpe": 1.775, "bear_sharpe": 1.371, "hivol_sharpe": 2.12, "lovol_sharpe": 1.518, "feb_jun_2020": -0.0219, "sr_17_19": 1.283, "sr_20": 2.167, "sr_21_23": 2.353, "sr_24_26H1": 1.118}, "bh_pass": true, "dsr": 0.999, "n_trials_family": 9, "n_trials_cumulative": 41, "status": "success"}
{"timestamp": "2026-07-08T22:58:08Z", "git_commit": "4777e4e", "git_dirty": true, "hypothesis_ref": "RL-2026-07-10", "universe": "NIFTY500", "cost_bps": 20.0, "split": "2017-01-01", "strategy": "LO-BAND", "n_assets": 277, "metrics": {"strategy": "LO-BAND", "test_sharpe": 1.628, "test_tstat": 4.97, "ann_return": 0.2685, "ann_vol": 0.1534, "max_dd": -0.2754, "turnover": 0.0191, "beats_nifty": true, "act_ret_tr": 0.1281, "act_t_tr": 1.85, "beta_tr": 0.485, "alpha_t_tr": 4.16, "act_ret_ew": 0.0127, "act_t_ew": -0.04, "beta_ew": 0.617, "alpha_t_ew": 2.86, "beats_ew": false, "bull_sharpe": 1.722, "bear_sharpe": 1.27, "hivol_sharpe": 1.918, "lovol_sharpe": 1.51, "feb_jun_2020": -0.0275, "sr_17_19": 0.939, "sr_20": 2.27, "sr_21_23": 2.383, "sr_24_26H1": 1.177}, "bh_pass": true, "dsr": 0.999, "n_trials_family": 9, "n_trials_cumulative": 41, "status": "success"}
{"timestamp": "2026-07-08T22:58:08Z", "git_commit": "4777e4e", "git_dirty": true, "hypothesis_ref": "RL-2026-07-10", "universe": "NIFTY500", "cost_bps": 20.0, "split": "2017-01-01", "strategy": "LS-CORE", "n_assets": 277, "metrics": {"strategy": "LS-CORE", "test_sharpe": 0.802, "test_tstat": 2.45, "ann_return": 0.0432, "ann_vol": 0.0546, "max_dd": -0.1994, "turnover": 0.0178, "beats_nifty": true, "act_ret_tr": -0.0972, "act_t_tr": -1.52, "beta_tr": 0.018, "alpha_t_tr": 2.3, "act_ret_ew": -0.2126, "act_t_ew": -2.5, "beta_ew": 0.016, "alpha_t_ew": 2.23, "beats_ew": false, "bull_sharpe": 1.515, "bear_sharpe": -1.387, "hivol_sharpe": -0.754, "lovol_sharpe": 1.604, "feb_jun_2020": -0.071, "sr_17_19": 1.981, "sr_20": -1.431, "sr_21_23": 1.573, "sr_24_26H1": 0.088}, "bh_pass": true, "dsr": 0.787, "n_trials_family": 9, "n_trials_cumulative": 41, "status": "success"}
{"timestamp": "2026-07-08T22:58:08Z", "git_commit": "4777e4e", "git_dirty": true, "hypothesis_ref": "RL-2026-07-10", "universe": "NIFTY500", "cost_bps": 20.0, "split": "2017-01-01", "strategy": "LS-RESID2", "n_assets": 277, "metrics": {"strategy": "LS-RESID2", "test_sharpe": 0.856, "test_tstat": 2.61, "ann_return": 0.0463, "ann_vol": 0.0546, "max_dd": -0.1897, "turnover": 0.0177, "beats_nifty": true, "act_ret_tr": -0.0942, "act_t_tr": -1.48, "beta_tr": 0.017, "alpha_t_tr": 2.47, "act_ret_ew": -0.2096, "act_t_ew": -2.48, "beta_ew": 0.017, "alpha_t_ew": 2.37, "beats_ew": false, "bull_sharpe": 1.577, "bear_sharpe": -1.379, "hivol_sharpe": -0.66, "lovol_sharpe": 1.625, "feb_jun_2020": -0.0674, "sr_17_19": 1.99, "sr_20": -1.374, "sr_21_23": 1.648, "sr_24_26H1": 0.126}, "bh_pass": true, "dsr": 0.83, "n_trials_family": 9, "n_trials_cumulative": 41, "status": "success"}
{"timestamp": "2026-07-08T23:10:09Z", "git_commit": "4777e4e", "git_dirty": true, "hypothesis_ref": "RL-2026-07-10", "universe": "NIFTY500", "cost_bps": 20.0, "split": "2017-01-01", "strategy": "LO-CORE", "n_assets": 277, "metrics": {"strategy": "LO-CORE", "test_sharpe": 1.628, "test_tstat": 4.96, "ann_return": 0.276, "ann_vol": 0.1575, "max_dd": -0.2689, "turnover": 0.0241, "beats_nifty": true, "act_ret_tr": 0.1355, "act_t_tr": 1.92, "beta_tr": 0.492, "alpha_t_tr": 4.16, "act_ret_ew": 0.0201, "act_t_ew": 0.06, "beta_ew": 0.628, "alpha_t_ew": 2.86, "beats_ew": false, "bull_sharpe": 1.732, "bear_sharpe": 1.191, "hivol_sharpe": 1.973, "lovol_sharpe": 1.486, "feb_jun_2020": -0.0296, "sr_17_19": 0.991, "sr_20": 2.289, "sr_21_23": 2.3, "sr_24_26H1": 1.21}, "bh_pass": true, "dsr": 0.006, "n_trials_family": 9, "n_trials_cumulative": 41, "status": "success"}
{"timestamp": "2026-07-08T23:10:09Z", "git_commit": "4777e4e", "git_dirty": true, "hypothesis_ref": "RL-2026-07-10", "universe": "NIFTY500", "cost_bps": 20.0, "split": "2017-01-01", "strategy": "LO-CORE-NOOVERLAY", "n_assets": 277, "metrics": {"strategy": "LO-CORE-NOOVERLAY", "test_sharpe": 1.507, "test_tstat": 4.6, "ann_return": 0.319, "ann_vol": 0.1968, "max_dd": -0.3638, "turnover": 0.0253, "beats_nifty": true, "act_ret_tr": 0.1786, "act_t_tr": 3.48, "beta_tr": 0.922, "alpha_t_tr": 3.93, "act_ret_ew": 0.0631, "act_t_ew": 1.69, "beta_ew": 1.016, "alpha_t_ew": 2.07, "beats_ew": false, "bull_sharpe": 1.882, "bear_sharpe": 0.667, "hivol_sharpe": 1.683, "lovol_sharpe": 1.455, "feb_jun_2020": -0.1076, "sr_17_19": 1.644, "sr_20": 1.171, "sr_21_23": 2.358, "sr_24_26H1": 0.745}, "bh_pass": true, "dsr": 0.002, "n_trials_family": 9, "n_trials_cumulative": 41, "status": "success"}
{"timestamp": "2026-07-08T23:10:09Z", "git_commit": "4777e4e", "git_dirty": true, "hypothesis_ref": "RL-2026-07-10", "universe": "NIFTY500", "cost_bps": 20.0, "split": "2017-01-01", "strategy": "LO-EXT", "n_assets": 277, "metrics": {"strategy": "LO-EXT", "test_sharpe": 1.619, "test_tstat": 4.94, "ann_return": 0.2857, "ann_vol": 0.1636, "max_dd": -0.2757, "turnover": 0.0238, "beats_nifty": true, "act_ret_tr": 0.1452, "act_t_tr": 2.01, "beta_tr": 0.508, "alpha_t_tr": 4.13, "act_ret_ew": 0.0298, "act_t_ew": 0.21, "beta_ew": 0.655, "alpha_t_ew": 2.82, "beats_ew": false, "bull_sharpe": 1.724, "bear_sharpe": 1.18, "hivol_sharpe": 2.001, "lovol_sharpe": 1.464, "feb_jun_2020": -0.0295, "sr_17_19": 0.845, "sr_20": 2.381, "sr_21_23": 2.329, "sr_24_26H1": 1.24}, "bh_pass": true, "dsr": 0.005, "n_trials_family": 9, "n_trials_cumulative": 41, "status": "success"}
{"timestamp": "2026-07-08T23:10:09Z", "git_commit": "4777e4e", "git_dirty": true, "hypothesis_ref": "RL-2026-07-10", "universe": "NIFTY500", "cost_bps": 20.0, "split": "2017-01-01", "strategy": "LO-ERC", "n_assets": 277, "metrics": {"strategy": "LO-ERC", "test_sharpe": 1.696, "test_tstat": 5.17, "ann_return": 0.2798, "ann_vol": 0.1524, "max_dd": -0.2389, "turnover": 0.0234, "beats_nifty": true, "act_ret_tr": 0.1393, "act_t_tr": 1.97, "beta_tr": 0.471, "alpha_t_tr": 4.4, "act_ret_ew": 0.0239, "act_t_ew": 0.11, "beta_ew": 0.604, "alpha_t_ew": 3.17, "beats_ew": false, "bull_sharpe": 1.818, "bear_sharpe": 1.148, "hivol_sharpe": 2.011, "lovol_sharpe": 1.567, "feb_jun_2020": -0.0258, "sr_17_19": 1.124, "sr_20": 2.35, "sr_21_23": 2.399, "sr_24_26H1": 1.175}, "bh_pass": true, "dsr": 0.01, "n_trials_family": 9, "n_trials_cumulative": 41, "status": "success"}
{"timestamp": "2026-07-08T23:10:09Z", "git_commit": "4777e4e", "git_dirty": true, "hypothesis_ref": "RL-2026-07-10", "universe": "NIFTY500", "cost_bps": 20.0, "split": "2017-01-01", "strategy": "LO-VT", "n_assets": 277, "metrics": {"strategy": "LO-VT", "test_sharpe": 1.44, "test_tstat": 4.39, "ann_return": 0.2425, "ann_vol": 0.1598, "max_dd": -0.3067, "turnover": 0.0249, "beats_nifty": true, "act_ret_tr": 0.1021, "act_t_tr": 2.09, "beta_tr": 0.711, "alpha_t_tr": 3.53, "act_ret_ew": -0.0134, "act_t_ew": -0.53, "beta_ew": 0.805, "alpha_t_ew": 1.53, "beats_ew": false, "bull_sharpe": 1.844, "bear_sharpe": 0.358, "hivol_sharpe": 1.43, "lovol_sharpe": 1.459, "feb_jun_2020": -0.1421, "sr_17_19": 1.566, "sr_20": 1.119, "sr_21_23": 2.444, "sr_24_26H1": 0.401}, "bh_pass": true, "dsr": 0.001, "n_trials_family": 9, "n_trials_cumulative": 41, "status": "success"}
{"timestamp": "2026-07-08T23:10:09Z", "git_commit": "4777e4e", "git_dirty": true, "hypothesis_ref": "RL-2026-07-10", "universe": "NIFTY500", "cost_bps": 20.0, "split": "2017-01-01", "strategy": "REGIME", "n_assets": 277, "metrics": {"strategy": "REGIME", "test_sharpe": 1.698, "test_tstat": 5.18, "ann_return": 0.2991, "ann_vol": 0.162, "max_dd": -0.2188, "turnover": 0.0282, "beats_nifty": true, "act_ret_tr": 0.1587, "act_t_tr": 2.73, "beta_tr": 0.638, "alpha_t_tr": 4.49, "act_ret_ew": 0.0433, "act_t_ew": 0.52, "beta_ew": 0.75, "alpha_t_ew": 3.14, "beats_ew": false, "bull_sharpe": 1.775, "bear_sharpe": 1.371, "hivol_sharpe": 2.12, "lovol_sharpe": 1.518, "feb_jun_2020": -0.0219, "sr_17_19": 1.283, "sr_20": 2.167, "sr_21_23": 2.353, "sr_24_26H1": 1.118}, "bh_pass": true, "dsr": 0.01, "n_trials_family": 9, "n_trials_cumulative": 41, "status": "success"}
{"timestamp": "2026-07-08T23:10:09Z", "git_commit": "4777e4e", "git_dirty": true, "hypothesis_ref": "RL-2026-07-10", "universe": "NIFTY500", "cost_bps": 20.0, "split": "2017-01-01", "strategy": "LO-BAND", "n_assets": 277, "metrics": {"strategy": "LO-BAND", "test_sharpe": 1.628, "test_tstat": 4.97, "ann_return": 0.2685, "ann_vol": 0.1534, "max_dd": -0.2754, "turnover": 0.0191, "beats_nifty": true, "act_ret_tr": 0.1281, "act_t_tr": 1.85, "beta_tr": 0.485, "alpha_t_tr": 4.16, "act_ret_ew": 0.0127, "act_t_ew": -0.04, "beta_ew": 0.617, "alpha_t_ew": 2.86, "beats_ew": false, "bull_sharpe": 1.722, "bear_sharpe": 1.27, "hivol_sharpe": 1.918, "lovol_sharpe": 1.51, "feb_jun_2020": -0.0275, "sr_17_19": 0.939, "sr_20": 2.27, "sr_21_23": 2.383, "sr_24_26H1": 1.177}, "bh_pass": true, "dsr": 0.006, "n_trials_family": 9, "n_trials_cumulative": 41, "status": "success"}
{"timestamp": "2026-07-08T23:10:09Z", "git_commit": "4777e4e", "git_dirty": true, "hypothesis_ref": "RL-2026-07-10", "universe": "NIFTY500", "cost_bps": 20.0, "split": "2017-01-01", "strategy": "LS-CORE", "n_assets": 277, "metrics": {"strategy": "LS-CORE", "test_sharpe": 0.802, "test_tstat": 2.45, "ann_return": 0.0432, "ann_vol": 0.0546, "max_dd": -0.1994, "turnover": 0.0178, "beats_nifty": true, "act_ret_tr": -0.0972, "act_t_tr": -1.52, "beta_tr": 0.018, "alpha_t_tr": 2.3, "act_ret_ew": -0.2126, "act_t_ew": -2.5, "beta_ew": 0.016, "alpha_t_ew": 2.23, "beats_ew": false, "bull_sharpe": 1.515, "bear_sharpe": -1.387, "hivol_sharpe": -0.754, "lovol_sharpe": 1.604, "feb_jun_2020": -0.071, "sr_17_19": 1.981, "sr_20": -1.431, "sr_21_23": 1.573, "sr_24_26H1": 0.088}, "bh_pass": true, "dsr": 0.0, "n_trials_family": 9, "n_trials_cumulative": 41, "status": "success"}
