{"timestamp": "2026-07-08T23:10:09Z", "git_commit": "4777e4e", "git_dirty": true, "hypothesis_ref": "RL-2026-07-10", "universe": "NIFTY500", "cost_bps": 20.0, "split": "2017-01-01", "strategy": "LS-RESID2", "n_assets": 277, "metrics": {"strategy": "LS-RESID2", "test_sharpe": 0.856, "test_tstat": 2.61, "ann_return": 0.0463, "ann_vol": 0.0546, "max_dd": -0.1897, "turnover": 0.0177, "beats_nifty": true, "act_ret_tr": -0.0942, "act_t_tr": -1.48, "beta_tr": 0.017, "alpha_t_tr": 2.47, "act_ret_ew": -0.2096, "act_t_ew": -2.48, "beta_ew": 0.017, "alpha_t_ew": 2.37, "beats_ew": false, "bull_sharpe": 1.577, "bear_sharpe": -1.379, "hivol_sharpe": -0.66, "lovol_sharpe": 1.625, "feb_jun_2020": -0.0674, "sr_17_19": 1.99, "sr_20": -1.374, "sr_21_23": 1.648, "sr_24_26H1": 0.126}, "bh_pass": true, "dsr": 0.0, "n_trials_family": 9, "n_trials_cumulative": 41, "status": "success"}
{"timestamp": "2026-07-09T07:55:39Z", "git_commit": "f52efaf", "git_dirty": true, "hypothesis_ref": "RL-2026-07-12", "universe": "NIFTY500", "cost_bps": 20.0, "split": "2017-01-01", "strategy": "LS-UNRESTRICTED", "n_assets": 277, "n_shortable": 210, "n_overlap": 130, "short_mode": "thin", "metrics": {"sharpe": 0.866, "t": 2.64, "ann_return": 0.0468, "maxdd": -0.1897, "capm_beta_nifty": 0.017, "capm_alpha_t": 2.52}, "status": "success"}
{"timestamp": "2026-07-09T07:55:39Z", "git_commit": "f52efaf", "git_dirty": true, "hypothesis_ref": "RL-2026-07-12", "universe": "NIFTY500", "cost_bps": 20.0, "split": "2017-01-01", "strategy": "LS-FNO-THIN", "n_assets": 277, "n_shortable": 210, "n_overlap": 130, "short_mode": "thin", "metrics": {"sharpe": 0.846, "t": 2.58, "ann_return": 0.0538, "maxdd": -0.1632, "capm_beta_nifty": -0.0, "capm_alpha_t": 2.58}, "status": "success", "corr_regime": 0.371, "dsr": 0.0, "n_trials_family": 32, "n_trials_cumulative": 51, "sensitivities": [{"scenario": "headline 20bps", "sharpe": 0.846, "t": 2.58, "ann_return": 0.0538}, {"scenario": "carry +3%", "sharpe": 1.081, "t": 3.3, "ann_return": 0.0699}, {"scenario": "carry +5%", "sharpe": 1.237, "t": 3.78, "ann_return": 0.0807}, {"scenario": "roll drag 12bps/yr", "sharpe": 0.837, "t": 2.55, "ann_return": 0.0532}, {"scenario": "carry +3% - roll 12bps", "sharpe": 1.071, "t": 3.27, "ann_return": 0.0692}], "cost_check": [{"scenario": "cost 10bps", "sharpe": 0.921, "t": 2.81, "ann_return": 0.059}, {"scenario": "cost 40bps", "sharpe": 0.695, "t": 2.12, "ann_return": 0.0436}]}
{"timestamp": "2026-07-09T08:14:16Z", "git_commit": "074cc2f", "git_dirty": true, "hypothesis_ref": "RL-2026-07-14", "universe": "NIFTY500", "cost_bps": 20.0, "split": "2017-01-01", "strategy": "H52-MOM", "frozen_signal": "off_low", "n_assets": 277, "metrics": {"cost_bps": 20, "book": "MOM", "test_sharpe": 1.865, "ann_return": 0.3574, "max_dd": -0.2718, "act_t_ew": 1.06}, "diversification": {"active_corr_vs_mom": 0.944, "raw_corr_vs_mom": 0.954, "mom_sharpe": 1.865, "blend_sharpe": 1.776, "blend_minus_mom_t": 0.583, "promoted": false}, "status": "success"}
{"timestamp": "2026-07-09T08:14:16Z", "git_commit": "074cc2f", "git_dirty": true, "hypothesis_ref": "RL-2026-07-14", "universe": "NIFTY500", "cost_bps": 20.0, "split": "2017-01-01", "strategy": "H52-BLEND", "frozen_signal": "off_low", "n_assets": 277, "metrics": {"cost_bps": 20, "book": "BLEND", "test_sharpe": 1.776, "ann_return": 0.3631, "max_dd": -0.3435, "act_t_ew": 1.11}, "diversification": {"active_corr_vs_mom": 0.944, "raw_corr_vs_mom": 0.954, "mom_sharpe": 1.865, "blend_sharpe": 1.776, "blend_minus_mom_t": 0.583, "promoted": false}, "status": "success"}
{"timestamp": "2026-07-09T08:14:16Z", "git_commit": "074cc2f", "git_dirty": true, "hypothesis_ref": "RL-2026-07-14", "universe": "NIFTY500", "cost_bps": 20.0, "split": "2017-01-01", "strategy": "H52-H52", "frozen_signal": "off_low", "n_assets": 277, "metrics": {"cost_bps": 20, "book": "H52", "test_sharpe": 1.571, "ann_return": 0.3379, "max_dd": -0.5055, "act_t_ew": 0.87}, "diversification": {"active_corr_vs_mom": 0.944, "raw_corr_vs_mom": 0.954, "mom_sharpe": 1.865, "blend_sharpe": 1.776, "blend_minus_mom_t": 0.583, "promoted": false}, "status": "success"}
{"timestamp": "2026-07-09T08:16:30Z", "git_commit": "074cc2f", "git_dirty": true, "hypothesis_ref": "RL-2026-07-13", "universe": "NIFTY500+NIFTY100", "cost_bps": 10.0, "split": "2017-01-01", "strategy": "REGIME+bear_reversal_sleeve", "sleeve_variant": "LS-RESID-REV", "sleeve_size": 0.1, "metrics": {"base_sharpe": 1.906, "base_ann": 0.367, "base_maxdd": -0.2654, "sleeve_sharpe": 0.368, "sleeve_ann": 0.0121, "comb_sharpe": 1.912, "comb_ann": 0.3687, "comb_maxdd": -0.2688, "d_sharpe": 0.006, "paired_t_diff": 1.12, "corr_base_sleeve": 0.006}, "sleeve_dsr": 0.14, "n_trials_cumulative": 60, "status": "success"}
{"timestamp": "2026-07-09T08:16:30Z", "git_commit": "074cc2f", "git_dirty": true, "hypothesis_ref": "RL-2026-07-13", "universe": "NIFTY500+NIFTY100", "cost_bps": 20.0, "split": "2017-01-01", "strategy": "REGIME+bear_reversal_sleeve", "sleeve_variant": "LS-RESID-REV", "sleeve_size": 0.1, "metrics": {"base_sharpe": 1.865, "base_ann": 0.3574, "base_maxdd": -0.2718, "sleeve_sharpe": -0.228, "sleeve_ann": -0.0086, "comb_sharpe": 1.859, "comb_ann": 0.3563, "comb_maxdd": -0.2785, "d_sharpe": -0.006, "paired_t_diff": -0.69, "corr_base_sleeve": 0.013}, "sleeve_dsr": 0.14, "n_trials_cumulative": 60, "status": "success"}
{"timestamp": "2026-07-09T08:16:31Z", "git_commit": "074cc2f", "git_dirty": true, "hypothesis_ref": "RL-2026-07-13", "universe": "NIFTY500+NIFTY100", "cost_bps": 40.0, "split": "2017-01-01", "strategy": "REGIME+bear_reversal_sleeve", "sleeve_variant": "LS-RESID-REV", "sleeve_size": 0.1, "metrics": {"base_sharpe": 1.782, "base_ann": 0.3384, "base_maxdd": -0.2843, "sleeve_sharpe": -1.282, "sleeve_ann": -0.0489, "comb_sharpe": 1.752, "comb_ann": 0.3318, "comb_maxdd": -0.2973, "d_sharpe": -0.03, "paired_t_diff": -3.91, "corr_base_sleeve": 0.026}, "sleeve_dsr": 0.14, "n_trials_cumulative": 60, "status": "success"}
{"timestamp": "2026-07-09T08:22:57Z", "git_commit": "6285db9", "git_dirty": true, "hypothesis_ref": "RL-2026-07-13", "universe": "NIFTY500+NIFTY100", "cost_bps": 10.0, "split": "2017-01-01", "strategy": "REGIME+bear_reversal_sleeve", "sleeve_variant": "LS-RESID-REV", "sleeve_size": 0.1, "metrics": {"base_sharpe": 1.906, "base_ann": 0.367, "base_maxdd": -0.2654, "sleeve_sharpe": 0.368, "sleeve_ann": 0.0121, "comb_sharpe": 1.912, "comb_ann": 0.3687, "comb_maxdd": -0.2688, "d_sharpe": 0.006, "paired_t_diff": 1.12, "corr_base_sleeve": 0.006}, "sleeve_dsr": 0.14, "n_trials_cumulative": 60, "status": "success"}
{"timestamp": "2026-07-09T08:22:57Z", "git_commit": "6285db9", "git_dirty": true, "hypothesis_ref": "RL-2026-07-13", "universe": "NIFTY500+NIFTY100", "cost_bps": 20.0, "split": "2017-01-01", "strategy": "REGIME+bear_reversal_sleeve", "sleeve_variant": "LS-RESID-REV", "sleeve_size": 0.1, "metrics": {"base_sharpe": 1.865, "base_ann": 0.3574, "base_maxdd": -0.2718, "sleeve_sharpe": -0.228, "sleeve_ann": -0.0086, "comb_sharpe": 1.859, "comb_ann": 0.3563, "comb_maxdd": -0.2785, "d_sharpe": -0.006, "paired_t_diff": -0.69, "corr_base_sleeve": 0.013}, "sleeve_dsr": 0.14, "n_trials_cumulative": 60, "status": "success"}
{"timestamp": "2026-07-09T08:22:57Z", "git_commit": "6285db9", "git_dirty": true, "hypothesis_ref": "RL-2026-07-13", "universe": "NIFTY500+NIFTY100", "cost_bps": 40.0, "split": "2017-01-01", "strategy": "REGIME+bear_reversal_sleeve", "sleeve_variant": "LS-RESID-REV", "sleeve_size": 0.1, "metrics": {"base_sharpe": 1.782, "base_ann": 0.3384, "base_maxdd": -0.2843, "sleeve_sharpe": -1.282, "sleeve_ann": -0.0489, "comb_sharpe": 1.752, "comb_ann": 0.3318, "comb_maxdd": -0.2973, "d_sharpe": -0.03, "paired_t_diff": -3.91, "corr_base_sleeve": 0.026}, "sleeve_dsr": 0.14, "n_trials_cumulative": 60, "status": "success"}
{"timestamp": "2026-07-09T09:07:24Z", "git_commit": "0bbc4b2", "git_dirty": true, "hypothesis_ref": "RL-2026-07-16", "universe": "NIFTY500+GOLDBEES", "cost_bps": 10.0, "split": "2017-01-01", "strategy": "REGIME+gold_sleeve", "frozen_variant": "gold", "metrics": {"sharpe": 1.888, "ann": 0.427, "maxdd": -0.3098, "d_sharpe_vs_cash": -0.018, "d_maxdd_vs_cash": -0.0444, "paired_t_vs_cash": 1.45}, "all_variants": {"cash": {"sharpe": 1.906, "ann": 0.367, "maxdd": -0.2654, "d_sharpe_vs_cash": 0.0, "d_maxdd_vs_cash": 0.0, "paired_t_vs_cash": 0.0}, "gold": {"sharpe": 1.888, "ann": 0.427, "maxdd": -0.3098, "d_sharpe_vs_cash": -0.018, "d_maxdd_vs_cash": -0.0444, "paired_t_vs_cash": 1.45}, "lowbeta": {"sharpe": 1.97, "ann": 0.4366, "maxdd": -0.2876, "d_sharpe_vs_cash": 0.064, "d_maxdd_vs_cash": -0.0222, "paired_t_vs_cash": 1.83}, "gold_lowbeta": {"sharpe": 2.04, "ann": 0.4353, "maxdd": -0.2648, "d_sharpe_vs_cash": 0.134, "d_maxdd_vs_cash": 0.0006, "paired_t_vs_cash": 2.19}}, "deploy": false, "n_trials_cumulative": 64, "status": "success"}
{"timestamp": "2026-07-09T09:07:24Z", "git_commit": "0bbc4b2", "git_dirty": true, "hypothesis_ref": "RL-2026-07-16", "universe": "NIFTY500+GOLDBEES", "cost_bps": 20.0, "split": "2017-01-01", "strategy": "REGIME+gold_sleeve", "frozen_variant": "gold", "metrics": {"sharpe": 1.836, "ann": 0.4126, "maxdd": -0.3199, "d_sharpe_vs_cash": -0.029, "d_maxdd_vs_cash": -0.0481, "paired_t_vs_cash": 1.36}, "all_variants": {"cash": {"sharpe": 1.865, "ann": 0.3574, "maxdd": -0.2718, "d_sharpe_vs_cash": 0.0, "d_maxdd_vs_cash": 0.0, "paired_t_vs_cash": 0.0}, "gold": {"sharpe": 1.836, "ann": 0.4126, "maxdd": -0.3199, "d_sharpe_vs_cash": -0.029, "d_maxdd_vs_cash": -0.0481, "paired_t_vs_cash": 1.36}, "lowbeta": {"sharpe": 1.913, "ann": 0.4207, "maxdd": -0.3027, "d_sharpe_vs_cash": 0.048, "d_maxdd_vs_cash": -0.0309, "paired_t_vs_cash": 1.69}, "gold_lowbeta": {"sharpe": 1.982, "ann": 0.4201, "maxdd": -0.2753, "d_sharpe_vs_cash": 0.117, "d_maxdd_vs_cash": -0.0035, "paired_t_vs_cash": 2.04}}, "deploy": false, "n_trials_cumulative": 64, "status": "success"}
{"timestamp": "2026-07-09T09:07:24Z", "git_commit": "0bbc4b2", "git_dirty": true, "hypothesis_ref": "RL-2026-07-16", "universe": "NIFTY500+GOLDBEES", "cost_bps": 40.0, "split": "2017-01-01", "strategy": "REGIME+gold_sleeve", "frozen_variant": "gold", "metrics": {"sharpe": 1.731, "ann": 0.3841, "maxdd": -0.3396, "d_sharpe_vs_cash": -0.051, "d_maxdd_vs_cash": -0.0553, "paired_t_vs_cash": 1.17}, "all_variants": {"cash": {"sharpe": 1.782, "ann": 0.3384, "maxdd": -0.2843, "d_sharpe_vs_cash": 0.0, "d_maxdd_vs_cash": 0.0, "paired_t_vs_cash": 0.0}, "gold": {"sharpe": 1.731, "ann": 0.3841, "maxdd": -0.3396, "d_sharpe_vs_cash": -0.051, "d_maxdd_vs_cash": -0.0553, "paired_t_vs_cash": 1.17}, "lowbeta": {"sharpe": 1.796, "ann": 0.3893, "maxdd": -0.3319, "d_sharpe_vs_cash": 0.014, "d_maxdd_vs_cash": -0.0476, "paired_t_vs_cash": 1.41}, "gold_lowbeta": {"sharpe": 1.865, "ann": 0.3902, "maxdd": -0.2982, "d_sharpe_vs_cash": 0.083, "d_maxdd_vs_cash": -0.0139, "paired_t_vs_cash": 1.73}}, "deploy": false, "n_trials_cumulative": 64, "status": "success"}
{"timestamp": "2026-07-09T09:09:24Z", "git_commit": "0bbc4b2", "git_dirty": true, "hypothesis_ref": "RL-2026-07-16", "universe": "NIFTY500+GOLDBEES", "cost_bps": 10.0, "split": "2017-01-01", "strategy": "REGIME+lowbeta_sleeve", "frozen_variant": "lowbeta", "metrics": {"sharpe": 1.97, "ann": 0.4366, "maxdd": -0.2876, "d_sharpe_vs_cash": 0.064, "d_maxdd_vs_cash": -0.0222, "paired_t_vs_cash": 1.83}, "all_variants": {"cash": {"sharpe": 1.906, "ann": 0.367, "maxdd": -0.2654, "d_sharpe_vs_cash": 0.0, "d_maxdd_vs_cash": 0.0, "paired_t_vs_cash": 0.0}, "gold": {"sharpe": 1.888, "ann": 0.427, "maxdd": -0.3098, "d_sharpe_vs_cash": -0.018, "d_maxdd_vs_cash": -0.0444, "paired_t_vs_cash": 1.45}, "lowbeta": {"sharpe": 1.97, "ann": 0.4366, "maxdd": -0.2876, "d_sharpe_vs_cash": 0.064, "d_maxdd_vs_cash": -0.0222, "paired_t_vs_cash": 1.83}, "gold_lowbeta": {"sharpe": 2.04, "ann": 0.4353, "maxdd": -0.2648, "d_sharpe_vs_cash": 0.134, "d_maxdd_vs_cash": 0.0006, "paired_t_vs_cash": 2.19}}, "deploy": false, "n_trials_cumulative": 64, "status": "success"}
{"timestamp": "2026-07-09T09:09:24Z", "git_commit": "0bbc4b2", "git_dirty": true, "hypothesis_ref": "RL-2026-07-16", "universe": "NIFTY500+GOLDBEES", "cost_bps": 20.0, "split": "2017-01-01", "strategy": "REGIME+lowbeta_sleeve", "frozen_variant": "lowbeta", "metrics": {"sharpe": 1.913, "ann": 0.4207, "maxdd": -0.3027, "d_sharpe_vs_cash": 0.048, "d_maxdd_vs_cash": -0.0309, "paired_t_vs_cash": 1.69}, "all_variants": {"cash": {"sharpe": 1.865, "ann": 0.3574, "maxdd": -0.2718, "d_sharpe_vs_cash": 0.0, "d_maxdd_vs_cash": 0.0, "paired_t_vs_cash": 0.0}, "gold": {"sharpe": 1.836, "ann": 0.4126, "maxdd": -0.3199, "d_sharpe_vs_cash": -0.029, "d_maxdd_vs_cash": -0.0481, "paired_t_vs_cash": 1.36}, "lowbeta": {"sharpe": 1.913, "ann": 0.4207, "maxdd": -0.3027, "d_sharpe_vs_cash": 0.048, "d_maxdd_vs_cash": -0.0309, "paired_t_vs_cash": 1.69}, "gold_lowbeta": {"sharpe": 1.982, "ann": 0.4201, "maxdd": -0.2753, "d_sharpe_vs_cash": 0.117, "d_maxdd_vs_cash": -0.0035, "paired_t_vs_cash": 2.04}}, "deploy": false, "n_trials_cumulative": 64, "status": "success"}
{"timestamp": "2026-07-09T09:09:24Z", "git_commit": "0bbc4b2", "git_dirty": true, "hypothesis_ref": "RL-2026-07-16", "universe": "NIFTY500+GOLDBEES", "cost_bps": 40.0, "split": "2017-01-01", "strategy": "REGIME+lowbeta_sleeve", "frozen_variant": "lowbeta", "metrics": {"sharpe": 1.796, "ann": 0.3893, "maxdd": -0.3319, "d_sharpe_vs_cash": 0.014, "d_maxdd_vs_cash": -0.0476, "paired_t_vs_cash": 1.41}, "all_variants": {"cash": {"sharpe": 1.782, "ann": 0.3384, "maxdd": -0.2843, "d_sharpe_vs_cash": 0.0, "d_maxdd_vs_cash": 0.0, "paired_t_vs_cash": 0.0}, "gold": {"sharpe": 1.731, "ann": 0.3841, "maxdd": -0.3396, "d_sharpe_vs_cash": -0.051, "d_maxdd_vs_cash": -0.0553, "paired_t_vs_cash": 1.17}, "lowbeta": {"sharpe": 1.796, "ann": 0.3893, "maxdd": -0.3319, "d_sharpe_vs_cash": 0.014, "d_maxdd_vs_cash": -0.0476, "paired_t_vs_cash": 1.41}, "gold_lowbeta": {"sharpe": 1.865, "ann": 0.3902, "maxdd": -0.2982, "d_sharpe_vs_cash": 0.083, "d_maxdd_vs_cash": -0.0139, "paired_t_vs_cash": 1.73}}, "deploy": false, "n_trials_cumulative": 64, "status": "success"}
{"timestamp": "2026-07-09T09:22:47Z", "git_commit": "4ec05c0", "git_dirty": true, "hypothesis_ref": "RL-2026-07-17", "universe": "NSE-ETF5", "cost_bps": 10.0, "split": "2017-01-01", "strategy": "xasset_trend_tsmom_invvol", "frozen_gate": "tsmom", "frozen_weighting": "invvol", "n_assets": 5, "metrics": {"cost_bps": 10, "test_sharpe": 1.074, "ann_return": 0.1116, "max_dd": -0.2794, "corr_regime": 0.357, "corr_ls": 0.137}, "regime_sharpe": 1.865, "ls_sharpe": 0.846, "promoted": true, "n_trials_family": 4, "n_trials_cumulative": 68, "status": "success"}
{"timestamp": "2026-07-09T09:22:47Z", "git_commit": "4ec05c0", "git_dirty": true, "hypothesis_ref": "RL-2026-07-17", "universe": "NSE-ETF5", "cost_bps": 20.0, "split": "2017-01-01", "strategy": "xasset_trend_tsmom_invvol", "frozen_gate": "tsmom", "frozen_weighting": "invvol", "n_assets": 5, "metrics": {"cost_bps": 20, "test_sharpe": 1.057, "ann_return": 0.1097, "max_dd": -0.2794, "corr_regime": 0.357, "corr_ls": 0.137}, "regime_sharpe": 1.865, "ls_sharpe": 0.846, "promoted": true, "n_trials_family": 4, "n_trials_cumulative": 68, "status": "success"}
{"timestamp": "2026-07-09T09:22:47Z", "git_commit": "4ec05c0", "git_dirty": true, "hypothesis_ref": "RL-2026-07-17", "universe": "NSE-ETF5", "cost_bps": 40.0, "split": "2017-01-01", "strategy": "xasset_trend_tsmom_invvol", "frozen_gate": "tsmom", "frozen_weighting": "invvol", "n_assets": 5, "metrics": {"cost_bps": 40, "test_sharpe": 1.023, "ann_return": 0.1058, "max_dd": -0.2795, "corr_regime": 0.357, "corr_ls": 0.137}, "regime_sharpe": 1.865, "ls_sharpe": 0.846, "promoted": true, "n_trials_family": 4, "n_trials_cumulative": 68, "status": "success"}
{"timestamp": "2026-07-09T09:54:13Z", "git_commit": "25ec4f6", "git_dirty": true, "hypothesis_ref": "RL-2026-07-19", "universe": "REGIME+FNO_LS+ETF_TREND", "cost_bps": 10.0, "split": "2017-01-01", "strategy": "blend_invvol", "frozen_rule": "invvol", "frozen_weights": {"regime": 0.2099, "ls": 0.4826, "trend": 0.3075}, "metrics": {"sharpe": 1.842, "ann": 0.1376, "maxdd": -0.1261, "paired_t_vs_regime": -4.9, "dmaxdd_vs_regime": 0.1393}, "all_rules": {"regime": {"sharpe": 1.906, "ann": 0.367, "maxdd": -0.2654, "paired_t_vs_regime": 0.0, "dmaxdd_vs_regime": 0.0}, "thirds": {"sharpe": 1.936, "ann": 0.1761, "maxdd": -0.1322, "paired_t_vs_regime": -4.79, "dmaxdd_vs_regime": 0.1332}, "invvol": {"sharpe": 1.842, "ann": 0.1376, "maxdd": -0.1261, "paired_t_vs_regime": -4.9, "dmaxdd_vs_regime": 0.1393}, "erc": {"sharpe": 1.791, "ann": 0.1273, "maxdd": -0.1253, "paired_t_vs_regime": -4.92, "dmaxdd_vs_regime": 0.1401}}, "deploy": false, "n_trials_family": 4, "n_trials_cumulative": 72, "status": "success"}
{"timestamp": "2026-07-09T09:54:13Z", "git_commit": "25ec4f6", "git_dirty": true, "hypothesis_ref": "RL-2026-07-19", "universe": "REGIME+FNO_LS+ETF_TREND", "cost_bps": 20.0, "split": "2017-01-01", "strategy": "blend_invvol", "frozen_rule": "invvol", "frozen_weights": {"regime": 0.2099, "ls": 0.4826, "trend": 0.3075}, "metrics": {"sharpe": 1.781, "ann": 0.1326, "maxdd": -0.1265, "paired_t_vs_regime": -4.83, "dmaxdd_vs_regime": 0.1453}, "all_rules": {"regime": {"sharpe": 1.865, "ann": 0.3574, "maxdd": -0.2718, "paired_t_vs_regime": 0.0, "dmaxdd_vs_regime": 0.0}, "thirds": {"sharpe": 1.883, "ann": 0.1707, "maxdd": -0.1326, "paired_t_vs_regime": -4.72, "dmaxdd_vs_regime": 0.1392}, "invvol": {"sharpe": 1.781, "ann": 0.1326, "maxdd": -0.1265, "paired_t_vs_regime": -4.83, "dmaxdd_vs_regime": 0.1453}, "erc": {"sharpe": 1.729, "ann": 0.1224, "maxdd": -0.1257, "paired_t_vs_regime": -4.85, "dmaxdd_vs_regime": 0.1461}}, "deploy": false, "n_trials_family": 4, "n_trials_cumulative": 72, "status": "success"}
{"timestamp": "2026-07-09T09:54:13Z", "git_commit": "25ec4f6", "git_dirty": true, "hypothesis_ref": "RL-2026-07-19", "universe": "REGIME+FNO_LS+ETF_TREND", "cost_bps": 40.0, "split": "2017-01-01", "strategy": "blend_invvol", "frozen_rule": "invvol", "frozen_weights": {"regime": 0.2099, "ls": 0.4826, "trend": 0.3075}, "metrics": {"sharpe": 1.657, "ann": 0.1228, "maxdd": -0.1272, "paired_t_vs_regime": -4.7, "dmaxdd_vs_regime": 0.1571}, "all_rules": {"regime": {"sharpe": 1.782, "ann": 0.3384, "maxdd": -0.2843, "paired_t_vs_regime": 0.0, "dmaxdd_vs_regime": 0.0}, "thirds": {"sharpe": 1.776, "ann": 0.1601, "maxdd": -0.1416, "paired_t_vs_regime": -4.57, "dmaxdd_vs_regime": 0.1427}, "invvol": {"sharpe": 1.657, "ann": 0.1228, "maxdd": -0.1272, "paired_t_vs_regime": -4.7, "dmaxdd_vs_regime": 0.1571}, "erc": {"sharpe": 1.601, "ann": 0.1128, "maxdd": -0.1265, "paired_t_vs_regime": -4.72, "dmaxdd_vs_regime": 0.1578}}, "deploy": false, "n_trials_family": 4, "n_trials_cumulative": 72, "status": "success"}
{"timestamp": "2026-07-09T10:01:14Z", "git_commit": "8054475", "git_dirty": true, "hypothesis_ref": "RL-2026-07-20", "universe": "NIFTYBEES.NS", "cost_bps": 5.0, "split": "2017-01-01", "strategy": "tom_N2_M3", "frozen_n": 2, "frozen_m": 3, "metrics": {"cost_bps": 5, "test_sharpe": 0.6, "ann_return": 0.0435, "max_dd": -0.2198}, "bh_sharpe": 0.937, "inside_outside_t": 1.134, "inside_outside_p": 0.2569, "promoted": false, "n_trials_family": 4, "status": "success"}
{"timestamp": "2026-07-09T10:01:14Z", "git_commit": "8054475", "git_dirty": true, "hypothesis_ref": "RL-2026-07-20", "universe": "NIFTYBEES.NS", "cost_bps": 10.0, "split": "2017-01-01", "strategy": "tom_N2_M3", "frozen_n": 2, "frozen_m": 3, "metrics": {"cost_bps": 10, "test_sharpe": 0.436, "ann_return": 0.0307, "max_dd": -0.2418}, "bh_sharpe": 0.937, "inside_outside_t": 1.134, "inside_outside_p": 0.2569, "promoted": false, "n_trials_family": 4, "status": "success"}
{"timestamp": "2026-07-09T10:01:14Z", "git_commit": "8054475", "git_dirty": true, "hypothesis_ref": "RL-2026-07-20", "universe": "NIFTYBEES.NS", "cost_bps": 20.0, "split": "2017-01-01", "strategy": "tom_N2_M3", "frozen_n": 2, "frozen_m": 3, "metrics": {"cost_bps": 20, "test_sharpe": 0.11, "ann_return": 0.0055, "max_dd": -0.284}, "bh_sharpe": 0.937, "inside_outside_t": 1.134, "inside_outside_p": 0.2569, "promoted": false, "n_trials_family": 4, "status": "success"}
{"timestamp": "2026-07-09T10:03:32Z", "git_commit": "8054475", "git_dirty": true, "hypothesis_ref": "RL-2026-07-21", "universe": "NIFTY500+GOLDBEES", "cost_bps": 10.0, "split": "2017-01-01", "strategy": "REGIME+voltarget_overlay", "frozen_sigma_target": 0.1, "frozen_window": 63, "metrics": {"sharpe": 1.794, "ann": 0.1952, "maxdd": -0.1984, "baseline_sharpe": 1.906, "baseline_ann": 0.367, "baseline_maxdd": -0.2654, "d_sharpe": -0.112, "d_maxdd": 0.067, "paired_t": -5.46, "inc_cost_drag": -0.00124}, "deploy": false, "n_trials_family": 4, "status": "success"}
{"timestamp": "2026-07-09T10:03:32Z", "git_commit": "8054475", "git_dirty": true, "hypothesis_ref": "RL-2026-07-21", "universe": "NIFTY500+GOLDBEES", "cost_bps": 20.0, "split": "2017-01-01", "strategy": "REGIME+voltarget_overlay", "frozen_sigma_target": 0.1, "frozen_window": 63, "metrics": {"sharpe": 1.737, "ann": 0.1883, "maxdd": -0.2051, "baseline_sharpe": 1.865, "baseline_ann": 0.3574, "baseline_maxdd": -0.2718, "d_sharpe": -0.128, "d_maxdd": 0.0667, "paired_t": -5.41, "inc_cost_drag": -0.002479}, "deploy": false, "n_trials_family": 4, "status": "success"}
{"timestamp": "2026-07-09T10:03:32Z", "git_commit": "8054475", "git_dirty": true, "hypothesis_ref": "RL-2026-07-21", "universe": "NIFTY500+GOLDBEES", "cost_bps": 40.0, "split": "2017-01-01", "strategy": "REGIME+voltarget_overlay", "frozen_sigma_target": 0.1, "frozen_window": 63, "metrics": {"sharpe": 1.623, "ann": 0.1745, "maxdd": -0.2183, "baseline_sharpe": 1.782, "baseline_ann": 0.3384, "baseline_maxdd": -0.2843, "d_sharpe": -0.159, "d_maxdd": 0.066, "paired_t": -5.32, "inc_cost_drag": -0.004958}, "deploy": false, "n_trials_family": 4, "status": "success"}
