{"timestamp": "2026-07-09T14:26:16Z", "git_commit": "be6596e", "git_dirty": true, "hypothesis_ref": "RL-2026-07-23", "universe": "NIFTYBEES.NS", "cost_bps": 5.0, "split": "2017-01-01", "strategy": "band_mr_k2.0_mean", "frozen_k": 2.0, "frozen_exit": "mean", "metrics": {"cost_bps": 5, "test_sharpe": 0.293, "ann_return": 0.0237, "max_dd": -0.3621, "lw_z_vs_bh": -2.186}, "bh_sharpe": 0.937, "lw_z_vs_bh": -2.186, "entries_per_yr": 3.86, "days_invested": 0.1683, "promoted": false, "n_trials_family": 4, "status": "success"}
{"timestamp": "2026-07-09T14:26:16Z", "git_commit": "be6596e", "git_dirty": true, "hypothesis_ref": "RL-2026-07-23", "universe": "NIFTYBEES.NS", "cost_bps": 10.0, "split": "2017-01-01", "strategy": "band_mr_k2.0_mean", "frozen_k": 2.0, "frozen_exit": "mean", "metrics": {"cost_bps": 10, "test_sharpe": 0.253, "ann_return": 0.0197, "max_dd": -0.365, "lw_z_vs_bh": -2.34}, "bh_sharpe": 0.937, "lw_z_vs_bh": -2.34, "entries_per_yr": 3.86, "days_invested": 0.1683, "promoted": false, "n_trials_family": 4, "status": "success"}
{"timestamp": "2026-07-09T14:26:16Z", "git_commit": "be6596e", "git_dirty": true, "hypothesis_ref": "RL-2026-07-23", "universe": "NIFTYBEES.NS", "cost_bps": 20.0, "split": "2017-01-01", "strategy": "band_mr_k2.0_mean", "frozen_k": 2.0, "frozen_exit": "mean", "metrics": {"cost_bps": 20, "test_sharpe": 0.173, "ann_return": 0.012, "max_dd": -0.3706, "lw_z_vs_bh": -2.655}, "bh_sharpe": 0.937, "lw_z_vs_bh": -2.655, "entries_per_yr": 3.86, "days_invested": 0.1683, "promoted": false, "n_trials_family": 4, "status": "success"}
{"timestamp": "2026-07-09T14:37:38Z", "git_commit": "53c7725", "git_dirty": true, "hypothesis_ref": "RL-2026-07-24", "universe": "NIFTY500", "cost_bps": 10.0, "split": "2017-01-01", "strategy": "REGIME+vix_rebound_p90_h10", "frozen_variant": "p90_h10", "episodes": 13, "metrics": {"sharpe": 1.88, "ann": 0.431, "maxdd": -0.2902, "baseline_sharpe": 1.906, "baseline_ann": 0.367, "baseline_maxdd": -0.2654, "d_sharpe": -0.026, "d_maxdd_pts": -2.48, "lw_sharpe_diff_z": -0.131}, "deploy": false, "n_trials_cumulative": 84, "status": "success"}
{"timestamp": "2026-07-09T14:37:39Z", "git_commit": "53c7725", "git_dirty": true, "hypothesis_ref": "RL-2026-07-24", "universe": "NIFTY500", "cost_bps": 20.0, "split": "2017-01-01", "strategy": "REGIME+vix_rebound_p90_h10", "frozen_variant": "p90_h10", "episodes": 13, "metrics": {"sharpe": 1.842, "ann": 0.4202, "maxdd": -0.296, "baseline_sharpe": 1.865, "baseline_ann": 0.3574, "baseline_maxdd": -0.2718, "d_sharpe": -0.023, "d_maxdd_pts": -2.42, "lw_sharpe_diff_z": -0.114}, "deploy": false, "n_trials_cumulative": 84, "status": "success"}
{"timestamp": "2026-07-09T14:37:39Z", "git_commit": "53c7725", "git_dirty": true, "hypothesis_ref": "RL-2026-07-24", "universe": "NIFTY500", "cost_bps": 40.0, "split": "2017-01-01", "strategy": "REGIME+vix_rebound_p90_h10", "frozen_variant": "p90_h10", "episodes": 13, "metrics": {"sharpe": 1.767, "ann": 0.3988, "maxdd": -0.3074, "baseline_sharpe": 1.782, "baseline_ann": 0.3384, "baseline_maxdd": -0.2843, "d_sharpe": -0.015, "d_maxdd_pts": -2.31, "lw_sharpe_diff_z": -0.08}, "deploy": false, "n_trials_cumulative": 84, "status": "success"}
{"timestamp": "2026-07-10T08:57:54Z", "git_commit": "1f9145f", "git_dirty": true, "hypothesis_ref": "RL-2026-07-26-02", "universe": "NIFTYBEES.NS", "us_signal": "^GSPC", "cost_bps": 10.0, "split": "2017-01-01", "strategy": "us_gate_ma200", "frozen_variant": "ma200", "train_argmax": "ma200", "metrics": {"test_sharpe": 1.043, "ann_return": 0.1151, "max_dd": -0.2081, "turnover": 56.0, "lw_z_vs_bh": 0.397}, "z10": 0.397, "z20": 0.19, "maxdd_better": true, "bh_sharpe": 0.935, "bh_maxdd": -0.3634, "disclosure_india_gate": {"sharpe": 0.768, "ann": 0.0783, "maxdd": -0.1855, "lw_z_vs_bh": -0.551}, "promoted": false, "n_trials_family": 4, "status": "success"}
{"timestamp": "2026-07-10T11:40:31Z", "git_commit": "289f40d", "git_dirty": true, "hypothesis_ref": "RL-2026-07-26-19", "universe": "NIFTY500", "n_assets": 277, "train_window": "2010-01-01:2016-12-31", "cost_bps": 40.0, "strategy": "illiq_L63", "variant": "L63", "lookback": 63, "frozen_variant": "L63", "train_argmax": "L63", "freeze_cost_bps": 40.0, "metrics": {"net_sharpe": 1.305, "ann_return": 0.106, "max_dd": -0.1766, "monthly_turnover": 0.112, "longleg_to_pctile": 0.0509}, "returns_last_date": "2016-12-30", "n_trials_family": 2, "status": "success"}
{"timestamp": "2026-07-10T11:40:31Z", "git_commit": "289f40d", "git_dirty": true, "hypothesis_ref": "RL-2026-07-26-19", "universe": "NIFTY500", "n_assets": 277, "train_window": "2010-01-01:2016-12-31", "cost_bps": 20.0, "strategy": "illiq_L63", "variant": "L63", "lookback": 63, "frozen_variant": "L63", "train_argmax": "L63", "freeze_cost_bps": 40.0, "metrics": {"net_sharpe": 1.375, "ann_return": 0.112, "max_dd": -0.173, "monthly_turnover": 0.112, "longleg_to_pctile": 0.0509}, "returns_last_date": "2016-12-30", "n_trials_family": 2, "status": "success"}
{"timestamp": "2026-07-10T11:40:31Z", "git_commit": "289f40d", "git_dirty": true, "hypothesis_ref": "RL-2026-07-26-19", "universe": "NIFTY500", "n_assets": 277, "train_window": "2010-01-01:2016-12-31", "cost_bps": 80.0, "strategy": "illiq_L63", "variant": "L63", "lookback": 63, "frozen_variant": "L63", "train_argmax": "L63", "freeze_cost_bps": 40.0, "metrics": {"net_sharpe": 1.165, "ann_return": 0.0941, "max_dd": -0.1839, "monthly_turnover": 0.112, "longleg_to_pctile": 0.0509}, "returns_last_date": "2016-12-30", "n_trials_family": 2, "status": "success"}
{"timestamp": "2026-07-10T11:40:31Z", "git_commit": "289f40d", "git_dirty": true, "hypothesis_ref": "RL-2026-07-26-19", "universe": "NIFTY500", "n_assets": 277, "train_window": "2010-01-01:2016-12-31", "cost_bps": 40.0, "strategy": "illiq_L252", "variant": "L252", "lookback": 252, "frozen_variant": "L63", "train_argmax": "L63", "freeze_cost_bps": 40.0, "metrics": {"net_sharpe": 1.239, "ann_return": 0.1008, "max_dd": -0.1598, "monthly_turnover": 0.0745, "longleg_to_pctile": 0.0505}, "returns_last_date": "2016-12-30", "n_trials_family": 2, "status": "success"}
{"timestamp": "2026-07-10T11:40:31Z", "git_commit": "289f40d", "git_dirty": true, "hypothesis_ref": "RL-2026-07-26-19", "universe": "NIFTY500", "n_assets": 277, "train_window": "2010-01-01:2016-12-31", "cost_bps": 20.0, "strategy": "illiq_L252", "variant": "L252", "lookback": 252, "frozen_variant": "L63", "train_argmax": "L63", "freeze_cost_bps": 40.0, "metrics": {"net_sharpe": 1.282, "ann_return": 0.1045, "max_dd": -0.1572, "monthly_turnover": 0.0745, "longleg_to_pctile": 0.0505}, "returns_last_date": "2016-12-30", "n_trials_family": 2, "status": "success"}
{"timestamp": "2026-07-10T11:40:31Z", "git_commit": "289f40d", "git_dirty": true, "hypothesis_ref": "RL-2026-07-26-19", "universe": "NIFTY500", "n_assets": 277, "train_window": "2010-01-01:2016-12-31", "cost_bps": 80.0, "strategy": "illiq_L252", "variant": "L252", "lookback": 252, "frozen_variant": "L63", "train_argmax": "L63", "freeze_cost_bps": 40.0, "metrics": {"net_sharpe": 1.152, "ann_return": 0.0934, "max_dd": -0.165, "monthly_turnover": 0.0745, "longleg_to_pctile": 0.0505}, "returns_last_date": "2016-12-30", "n_trials_family": 2, "status": "success"}
{"timestamp": "2026-07-10T11:46:54Z", "git_commit": "79639d2", "git_dirty": true, "hypothesis_ref": "RL-2026-07-26-20", "kind": "deliv_train", "universe": "NIFTY500", "window": "2011-07-01->2016-12-31", "strategy": "DELIV-LEVEL", "cost_bps": 20.0, "frozen_variant": "LEVEL", "freeze_margin_sr": 1.038, "archive_floor": "2011-07-01", "coverage": {"floor": "2011-07-01", "matched": 241, "median_valid_pct": 78.2, "train_days": 1709}, "metrics": {"variant": "LEVEL", "cost_bps": 20, "net_sharpe": 0.914, "t_stat": 2.38, "ann_return": 0.0847, "max_dd": -0.1317, "turnover": 7.0}, "status": "success"}
{"timestamp": "2026-07-10T11:46:54Z", "git_commit": "79639d2", "git_dirty": true, "hypothesis_ref": "RL-2026-07-26-20", "kind": "deliv_train", "universe": "NIFTY500", "window": "2011-07-01->2016-12-31", "strategy": "DELIV-LEVEL", "cost_bps": 40.0, "frozen_variant": "LEVEL", "freeze_margin_sr": 1.038, "archive_floor": "2011-07-01", "coverage": {"floor": "2011-07-01", "matched": 241, "median_valid_pct": 78.2, "train_days": 1709}, "metrics": {"variant": "LEVEL", "cost_bps": 40, "net_sharpe": 0.764, "t_stat": 1.99, "ann_return": 0.0696, "max_dd": -0.1367, "turnover": 7.0}, "status": "success"}
{"timestamp": "2026-07-10T11:46:54Z", "git_commit": "79639d2", "git_dirty": true, "hypothesis_ref": "RL-2026-07-26-20", "kind": "deliv_train", "universe": "NIFTY500", "window": "2011-07-01->2016-12-31", "strategy": "DELIV-SHOCK", "cost_bps": 20.0, "frozen_variant": "LEVEL", "freeze_margin_sr": 1.038, "archive_floor": "2011-07-01", "coverage": {"floor": "2011-07-01", "matched": 241, "median_valid_pct": 78.2, "train_days": 1709}, "metrics": {"variant": "SHOCK", "cost_bps": 20, "net_sharpe": -0.124, "t_stat": -0.32, "ann_return": -0.008, "max_dd": -0.2084, "turnover": 17.5}, "status": "success"}
{"timestamp": "2026-07-10T11:46:54Z", "git_commit": "79639d2", "git_dirty": true, "hypothesis_ref": "RL-2026-07-26-20", "kind": "deliv_train", "universe": "NIFTY500", "window": "2011-07-01->2016-12-31", "strategy": "DELIV-SHOCK", "cost_bps": 40.0, "frozen_variant": "LEVEL", "freeze_margin_sr": 1.038, "archive_floor": "2011-07-01", "coverage": {"floor": "2011-07-01", "matched": 241, "median_valid_pct": 78.2, "train_days": 1709}, "metrics": {"variant": "SHOCK", "cost_bps": 40, "net_sharpe": -0.743, "t_stat": -1.93, "ann_return": -0.0422, "max_dd": -0.2773, "turnover": 17.5}, "status": "success"}
{"timestamp": "2026-07-10T11:46:54Z", "git_commit": "79639d2", "git_dirty": true, "hypothesis_ref": "RL-2026-07-26-20", "kind": "deliv_train", "universe": "NIFTY500", "window": "2011-07-01->2016-12-31", "strategy": "DELIV-SIGNED", "cost_bps": 20.0, "frozen_variant": "LEVEL", "freeze_margin_sr": 1.038, "archive_floor": "2011-07-01", "coverage": {"floor": "2011-07-01", "matched": 241, "median_valid_pct": 78.2, "train_days": 1709}, "metrics": {"variant": "SIGNED", "cost_bps": 20, "net_sharpe": -1.013, "t_stat": -2.64, "ann_return": -0.0509, "max_dd": -0.3129, "turnover": 18.8}, "status": "success"}
{"timestamp": "2026-07-10T11:46:54Z", "git_commit": "79639d2", "git_dirty": true, "hypothesis_ref": "RL-2026-07-26-20", "kind": "deliv_train", "universe": "NIFTY500", "window": "2011-07-01->2016-12-31", "strategy": "DELIV-SIGNED", "cost_bps": 40.0, "frozen_variant": "LEVEL", "freeze_margin_sr": 1.038, "archive_floor": "2011-07-01", "coverage": {"floor": "2011-07-01", "matched": 241, "median_valid_pct": 78.2, "train_days": 1709}, "metrics": {"variant": "SIGNED", "cost_bps": 40, "net_sharpe": -1.675, "t_stat": -4.36, "ann_return": -0.0861, "max_dd": -0.4627, "turnover": 18.8}, "status": "success"}
{"timestamp": "2026-07-10T11:53:57Z", "git_commit": "dea7a89", "git_dirty": true, "hypothesis_ref": "RL-2026-07-26-20", "kind": "deliv_train", "universe": "NIFTY500", "window": "2011-07-01->2016-12-31", "strategy": "DELIV-LEVEL", "cost_bps": 20.0, "frozen_variant": "LEVEL", "freeze_margin_sr": 1.038, "archive_floor": "2011-07-01", "coverage": {"floor": "2011-07-01", "matched": 241, "median_valid_pct": 78.2, "train_days": 1709}, "metrics": {"variant": "LEVEL", "cost_bps": 20, "net_sharpe": 0.914, "t_stat": 2.38, "ann_return": 0.0847, "max_dd": -0.1317, "turnover": 7.0}, "status": "success"}
{"timestamp": "2026-07-10T11:53:57Z", "git_commit": "dea7a89", "git_dirty": true, "hypothesis_ref": "RL-2026-07-26-20", "kind": "deliv_train", "universe": "NIFTY500", "window": "2011-07-01->2016-12-31", "strategy": "DELIV-LEVEL", "cost_bps": 40.0, "frozen_variant": "LEVEL", "freeze_margin_sr": 1.038, "archive_floor": "2011-07-01", "coverage": {"floor": "2011-07-01", "matched": 241, "median_valid_pct": 78.2, "train_days": 1709}, "metrics": {"variant": "LEVEL", "cost_bps": 40, "net_sharpe": 0.764, "t_stat": 1.99, "ann_return": 0.0696, "max_dd": -0.1367, "turnover": 7.0}, "status": "success"}
{"timestamp": "2026-07-10T11:53:57Z", "git_commit": "dea7a89", "git_dirty": true, "hypothesis_ref": "RL-2026-07-26-20", "kind": "deliv_train", "universe": "NIFTY500", "window": "2011-07-01->2016-12-31", "strategy": "DELIV-SHOCK", "cost_bps": 20.0, "frozen_variant": "LEVEL", "freeze_margin_sr": 1.038, "archive_floor": "2011-07-01", "coverage": {"floor": "2011-07-01", "matched": 241, "median_valid_pct": 78.2, "train_days": 1709}, "metrics": {"variant": "SHOCK", "cost_bps": 20, "net_sharpe": -0.124, "t_stat": -0.32, "ann_return": -0.008, "max_dd": -0.2084, "turnover": 17.5}, "status": "success"}
{"timestamp": "2026-07-10T11:53:57Z", "git_commit": "dea7a89", "git_dirty": true, "hypothesis_ref": "RL-2026-07-26-20", "kind": "deliv_train", "universe": "NIFTY500", "window": "2011-07-01->2016-12-31", "strategy": "DELIV-SHOCK", "cost_bps": 40.0, "frozen_variant": "LEVEL", "freeze_margin_sr": 1.038, "archive_floor": "2011-07-01", "coverage": {"floor": "2011-07-01", "matched": 241, "median_valid_pct": 78.2, "train_days": 1709}, "metrics": {"variant": "SHOCK", "cost_bps": 40, "net_sharpe": -0.743, "t_stat": -1.93, "ann_return": -0.0422, "max_dd": -0.2773, "turnover": 17.5}, "status": "success"}
{"timestamp": "2026-07-10T11:53:57Z", "git_commit": "dea7a89", "git_dirty": true, "hypothesis_ref": "RL-2026-07-26-20", "kind": "deliv_train", "universe": "NIFTY500", "window": "2011-07-01->2016-12-31", "strategy": "DELIV-SIGNED", "cost_bps": 20.0, "frozen_variant": "LEVEL", "freeze_margin_sr": 1.038, "archive_floor": "2011-07-01", "coverage": {"floor": "2011-07-01", "matched": 241, "median_valid_pct": 78.2, "train_days": 1709}, "metrics": {"variant": "SIGNED", "cost_bps": 20, "net_sharpe": -1.013, "t_stat": -2.64, "ann_return": -0.0509, "max_dd": -0.3129, "turnover": 18.8}, "status": "success"}
{"timestamp": "2026-07-10T11:53:57Z", "git_commit": "dea7a89", "git_dirty": true, "hypothesis_ref": "RL-2026-07-26-20", "kind": "deliv_train", "universe": "NIFTY500", "window": "2011-07-01->2016-12-31", "strategy": "DELIV-SIGNED", "cost_bps": 40.0, "frozen_variant": "LEVEL", "freeze_margin_sr": 1.038, "archive_floor": "2011-07-01", "coverage": {"floor": "2011-07-01", "matched": 241, "median_valid_pct": 78.2, "train_days": 1709}, "metrics": {"variant": "SIGNED", "cost_bps": 40, "net_sharpe": -1.675, "t_stat": -4.36, "ann_return": -0.0861, "max_dd": -0.4627, "turnover": 18.8}, "status": "success"}
